article_id,year,title,url
1352,,Corporations. Political Spending. Federal Constitutional Protections. Legislative Advisory Question.,https://repository.uclawsf.edu/ca_ballot_props/1352
1350,,Criminal Sentences. Parole. Juvenile Criminal Proceedings and Sentencing. Initiative Constitutional Amendment and Statute.,https://repository.uclawsf.edu/ca_ballot_props/1350
1355,,Death Penalty. Initiative Statute.,https://repository.uclawsf.edu/ca_ballot_props/1355
1359,,Death Penalty. Procedures. Initiative Statute.,https://repository.uclawsf.edu/ca_ballot_props/1359
1351,,English Proficiency. Multilingual Education. Initiative Statute.,https://repository.uclawsf.edu/ca_ballot_props/1351
1356,,Firearms. Ammunition Sales. Initiative Statute.,https://repository.uclawsf.edu/ca_ballot_props/1356
1347,,Legislature. Legislation and Proceedings. Initiative Constitutional Amendment and Statute.,https://repository.uclawsf.edu/ca_ballot_props/1347
1357,,Marijuana Legalization. Initiative Statute.,https://repository.uclawsf.edu/ca_ballot_props/1357
1345,,Medi-Cal Hospital Fee Program. Initiative Constitutional Amendment and Statute,https://repository.uclawsf.edu/ca_ballot_props/1345
1346,,Revenue Bonds. Statewide Voter Approval. Initiative Constitutional Amendment.,https://repository.uclawsf.edu/ca_ballot_props/1346
1344,,School Bonds. Funding for K–12 School and Community College Facilities. Initiative Statute.,https://repository.uclawsf.edu/ca_ballot_props/1344
1354,,State Prescription Drug Purchases. Pricing Standards. Initiative Statute.,https://repository.uclawsf.edu/ca_ballot_props/1354
1333,,SUSPENSION OF LEGISLATORS. LEGISLATIVE CONSTITUTIONAL AMENDMENT.,https://repository.uclawsf.edu/ca_ballot_props/1333
1348,,Tax Extension to Fund Education and Healthcare. Initiative Constitutional Amendment.,https://repository.uclawsf.edu/ca_ballot_props/1348
1343,2016,"Voter Information Guide for 2016, General Election",https://repository.uclawsf.edu/ca_ballot_props/1343
1332,2016,"Voter Information Guide for 2016, Primary Election",https://repository.uclawsf.edu/ca_ballot_props/1332
1323,,Criminal Sentences. Misdemeanor Penalties.,https://repository.uclawsf.edu/ca_ballot_props/1323
1324,,Drug and Alcohol Testing of Doctors. Medical Negligence Lawsuits.,https://repository.uclawsf.edu/ca_ballot_props/1324
1325,,Healthcare Insurance. Rate Changes.,https://repository.uclawsf.edu/ca_ballot_props/1325
1322,,Indian Gaming Compacts.,https://repository.uclawsf.edu/ca_ballot_props/1322
1330,,PUBLIC RECORDS. OPEN MEETINGS. STATE REIMBURSEMENT TO LOCAL AGENCIES.,https://repository.uclawsf.edu/ca_ballot_props/1330
1326,,State Budget. Budget Stabilization Account.,https://repository.uclawsf.edu/ca_ballot_props/1326
1331,2014,VETERANS HOUSING AND HOMELESS PREVENTION BOND ACT OF 2014.,https://repository.uclawsf.edu/ca_ballot_props/1331
1328,2014,"Voter Information Guide for 2014, General Election",https://repository.uclawsf.edu/ca_ballot_props/1328
1329,2014,"Voter Information Guide for 2014, Primary Election",https://repository.uclawsf.edu/ca_ballot_props/1329
1327,,"Water Bond. Funding for Water Quality, Supply, Treatment, and Storage Projects.",https://repository.uclawsf.edu/ca_ballot_props/1327
1312,,AUTO INSURANCE COMPANIES. PRICES BASED ON DRIVER'S HISTORY OF INSURANCE COVERAGE.,https://repository.uclawsf.edu/ca_ballot_props/1312
1313,,DEATH PENALTY.,https://repository.uclawsf.edu/ca_ballot_props/1313
1316,,GENETICALLY ENGINEERED FOODS. LABELING.,https://repository.uclawsf.edu/ca_ballot_props/1316
1314,,HUMAN TRAFFICKING. PENALTIES.,https://repository.uclawsf.edu/ca_ballot_props/1314
1308,,IMPOSES ADDITIONAL TAX ON CIGARETTES FOR CANCER RESEARCH.,https://repository.uclawsf.edu/ca_ballot_props/1308
1307,,LIMITS ON LEGISLATORSâ€™ TERMS IN OFFICE.,https://repository.uclawsf.edu/ca_ballot_props/1307
1311,,POLITICAL CONTRIBUTIONS BY PAYROLL DEDUCTION. CONTRIBUTIONS TO CANDIDATES.,https://repository.uclawsf.edu/ca_ballot_props/1311
1319,,REDISTRICTING. STATE SENATE DISTRICTS.,https://repository.uclawsf.edu/ca_ballot_props/1319
1310,,STATE BUDGET. STATE AND LOCAL GOVERNMENT.,https://repository.uclawsf.edu/ca_ballot_props/1310
1317,,TAX TO FUND EDUCATION AND EARLY CHILDHOOD PROGRAMS.,https://repository.uclawsf.edu/ca_ballot_props/1317
1318,,TAX TREATMENT FOR MULTISTATE BUSINESSES. CLEAN ENERGY AND ENERGY EFFICIENCY FUNDING.,https://repository.uclawsf.edu/ca_ballot_props/1318
1309,,TEMPORARY TAXES TO FUND EDUCATION. GUARANTEED LOCAL PUBLIC SAFETY FUNDING.,https://repository.uclawsf.edu/ca_ballot_props/1309
1315,,THREE STRIKES LAW. REPEAT FELONY OFFENDERS. PENALTIES.,https://repository.uclawsf.edu/ca_ballot_props/1315
1320,2012,"Voter Information Guide for 2012, General Election",https://repository.uclawsf.edu/ca_ballot_props/1320
1321,2012,"Voter Information Guide for 2012, Primary",https://repository.uclawsf.edu/ca_ballot_props/1321
1304,,ALLOWS AUTO INSURANCE COMPANIES TO BASE THEIR PRICES IN PART ON A DRIVERâ€™S HISTORY OF INSURANCE COVERAGE.,https://repository.uclawsf.edu/ca_ballot_props/1304
1302,,CALIFORNIA FAIR ELECTIONS ACT.,https://repository.uclawsf.edu/ca_ballot_props/1302
1336,,CHANGES LEGISLATIVE VOTE REQUIREMENT TO PASS BUDGET AND BUDGET-RELATED LEGISLATION FROM TWO-THIRDS TO A SIMPLE MAJORITY. RETAINS TWO-THIRDS VOTE REQUI,https://repository.uclawsf.edu/ca_ballot_props/1336
1301,,ELECTIONS. INCREASES RIGHT TO PARTICIPATE IN PRIMARY ELECTIONS.,https://repository.uclawsf.edu/ca_ballot_props/1301
1334,,ELIMINATES STATE COMMISSION ON REDISTRICTING. CONSOLIDATES AUTHORITY FOR REDISTRICTING WITH ELECTED REPRESENTATIVES,https://repository.uclawsf.edu/ca_ballot_props/1334
1340,,ESTABLISHES $18 ANNUAL VEHICLE LICENSE SURCHARGE TO HELP FUND STATE PARKS AND WILDLIFE PROGRAMS. GRANTS SURCHARGED VEHICLES FREE ADMISSION TO ALL STAT,https://repository.uclawsf.edu/ca_ballot_props/1340
1303,,IMPOSES NEW TWO-THIRDS VOTER APPROVAL REQUIREMENT FOR LOCAL PUBLIC ELECTRICITY PROVIDERS.,https://repository.uclawsf.edu/ca_ballot_props/1303
1342,,LEGALIZES MARIJUANA UNDER CALIFORNIA BUT NOT FEDERAL LAW,https://repository.uclawsf.edu/ca_ballot_props/1342
1300,,LIMITS ON PROPERTY TAX ASSESSMENT. SEISMIC RETROFITTING OF EXISTING BUILDINGS.,https://repository.uclawsf.edu/ca_ballot_props/1300
1339,,"PROHIBITS THE STATE FROM BORROWING OR TAKING FUNDS USED FOR TRANSPORTATION, REDEVELOPMENT, OR LOCAL GOVERNMENT PROJECTS AND SERVICES",https://repository.uclawsf.edu/ca_ballot_props/1339
1341,,REDISTRICTING OF CONGRESSIONAL DISTRICTS,https://repository.uclawsf.edu/ca_ballot_props/1341
1337,,REPEALS RECENT LEGISLATION THAT WOULD ALLOW BUSINESSES TO LOWER THEIR TAX LIABILITY,https://repository.uclawsf.edu/ca_ballot_props/1337
1335,,REQUIRES THAT CERTAIN STATE AND LOCAL FEES BE APPROVED BY TWO-THIRDS VOTE. FEES INCLUDE THOSE THAT ADDRESS ADVERSE IMPACTS ON SOCIETY OR THE ENVIRONME,https://repository.uclawsf.edu/ca_ballot_props/1335
1338,,SUSPENDS IMPLEMENTATION OF AIR POLLUTION CONTROL LAW (AB 32) REQUIRING MAJOR SOURCES OF EMISSIONS TO REPORT AND REDUCE GREENHOUSE GAS EMISSIONS THAT C,https://repository.uclawsf.edu/ca_ballot_props/1338
1305,2010,"Voter Information Guide for 2010, General Election",https://repository.uclawsf.edu/ca_ballot_props/1305
1306,2010,"Voter Information Guide for 2010, Primary",https://repository.uclawsf.edu/ca_ballot_props/1306
1295,,EDUCATION FUNDING. PAYMENT PLAN.,https://repository.uclawsf.edu/ca_ballot_props/1295
1299,,ELECTED OFFICIALS' SALARIES.  PREVENTS PAY INCREASES DURING BUDGET DEFICIT YEARS.,https://repository.uclawsf.edu/ca_ballot_props/1299
1296,,LOTTERY MODERNIZATION ACT.,https://repository.uclawsf.edu/ca_ballot_props/1296
1298,,MENTAL HEALTH SERVICES FUNDING. TEMPORARY REALLOCATION.  HELPS BALANCE STATE BUDGET,https://repository.uclawsf.edu/ca_ballot_props/1298
1297,,PROTECTS CHILDREN'S SERVICES FUNDING.  HELPS BALANCE STATE BUDGET,https://repository.uclawsf.edu/ca_ballot_props/1297
1294,,"STATE BUDGET. CHANGES CALIFORNIA BUDGET PROCESS. LIMITS STATE SPENDING. INCREASES ""RAINY DAY"" BUDGET STABILIZATION FUND.",https://repository.uclawsf.edu/ca_ballot_props/1294
1293,2009,"Voter Information Guide for 2009, Special Election",https://repository.uclawsf.edu/ca_ballot_props/1293
