poll_id,source,source_url,date,question_type,question_wording,topic,issue_area,support_pct,oppose_pct,net,sample_size,methodology,population,moe,tags,notes
DFP_20250409_0627,Data for Progress,https://www.dataforprogress.org/blog/2025/4/9/voters-want-to-make-polluters-pay-oppose-efforts-to-grant-oil-and-gas-companies-immunity-for-climate-damages,2025-04-09,opinion,A majority of voters believe that climate change (54%) and pollution from fossil fuels (54%) will greatly or somewhat impact their finances.,climate,,54.0,,,1191,online_panel,voters,,dfp;climate;opinion,"Article: Voters Want to Make Polluters Pay, Oppose Efforts to Grant Oil and Gas Companies Immunity for Climate Damages. Narrative polling finding."
DFP_20250409_0628,Data for Progress,https://www.dataforprogress.org/blog/2025/4/9/voters-want-to-make-polluters-pay-oppose-efforts-to-grant-oil-and-gas-companies-immunity-for-climate-damages,2025-04-09,trust,"Across party lines, few trust oil and gas companies to prioritize consumers over profits, and a plurality do not trust them at all (34%), though Republicans notably express more trust in these companies.",climate,,34.0,,,1191,online_panel,voters,,dfp;climate;trust,"Article: Voters Want to Make Polluters Pay, Oppose Efforts to Grant Oil and Gas Companies Immunity for Climate Damages. Narrative polling finding."
DFP_20250409_0629,Data for Progress,https://www.dataforprogress.org/blog/2025/4/9/voters-want-to-make-polluters-pay-oppose-efforts-to-grant-oil-and-gas-companies-immunity-for-climate-damages,2025-04-09,concern,"Nearly half of voters express intense concern (49% very concerned) about oil and gas companies making record profits while consumers face rising energy costs, and a majority of Republicans say they are either very or somewhat concerned about this (70%).",climate,,49.0,,,1191,online_panel,voters,,dfp;climate;concern,"Article: Voters Want to Make Polluters Pay, Oppose Efforts to Grant Oil and Gas Companies Immunity for Climate Damages. Narrative polling finding."
DFP_20250409_0630,Data for Progress,https://www.dataforprogress.org/blog/2025/4/9/voters-want-to-make-polluters-pay-oppose-efforts-to-grant-oil-and-gas-companies-immunity-for-climate-damages,2025-04-09,concern,"In addition to these concerns, voters also report experiencing or expecting to experience a variety of impacts from climate change, with a majority reporting they have already faced or expect to face higher food prices due to crop failures (55%) and higher cooling costs during hotter summers (50%).",economy,,55.0,,,1191,online_panel,voters,,dfp;economy;concern,"Article: Voters Want to Make Polluters Pay, Oppose Efforts to Grant Oil and Gas Companies Immunity for Climate Damages. Narrative polling finding."
DFP_20250409_0631,Data for Progress,https://www.dataforprogress.org/blog/2025/4/9/voters-want-to-make-polluters-pay-oppose-efforts-to-grant-oil-and-gas-companies-immunity-for-climate-damages,2025-04-09,concern,"Similarly, voters express high concern (77% very or somewhat concerned) about funding for the Federal Emergency Management Agency (FEMA) and disaster relief being insufficient to help communities affected by climate disasters, a finding that holds up across all demographic groups surveyed.",climate,,77.0,,,1191,online_panel,voters,,dfp;climate;concern,"Article: Voters Want to Make Polluters Pay, Oppose Efforts to Grant Oil and Gas Companies Immunity for Climate Damages. Narrative polling finding."
DFP_20250328_0632,Data for Progress,https://www.dataforprogress.org/blog/2025/3/28/democratic-voters-are-dissatisfied-with-their-own-party-see-no-clear-party-leader,2025-03-28,polling_finding,"When Democratic voters are asked how they would grade the Democratic Party on its response to Trump, 70% give the party a C or below.",other,,70.0,,,,online_panel,voters,,dfp;other;polling_finding,"Article: Democratic Voters Are Dissatisfied With Their Own Party, See No Clear Party Leader. Narrative polling finding."
DFP_20250328_0633,Data for Progress,https://www.dataforprogress.org/blog/2025/3/28/democratic-voters-are-dissatisfied-with-their-own-party-see-no-clear-party-leader,2025-03-28,polling_finding,About 1 in 5 Democratic voters (21%) give the party an F.,other,,21.0,,,,online_panel,voters,,dfp;other;polling_finding,"Article: Democratic Voters Are Dissatisfied With Their Own Party, See No Clear Party Leader. Narrative polling finding."
DFP_20250328_0634,Data for Progress,https://www.dataforprogress.org/blog/2025/3/28/democratic-voters-are-dissatisfied-with-their-own-party-see-no-clear-party-leader,2025-03-28,opinion,"Seventeen percent say that Kamala Harris is the current leader, followed by Schumer (15%), Barack Obama (15%), Hakeem Jeffries (11%), and “no one” (11%).",housing,,15.0,,,,online_panel,voters,,dfp;housing;opinion,"Article: Democratic Voters Are Dissatisfied With Their Own Party, See No Clear Party Leader. Narrative polling finding."
DFP_20250328_0635,Data for Progress,https://www.dataforprogress.org/blog/2025/3/28/democratic-voters-are-dissatisfied-with-their-own-party-see-no-clear-party-leader,2025-03-28,favorability,"Following Schumer’s push to vote in favor of the Republican budget resolution, Democratic voters say that Schumer is not doing enough to fight back against Trump by a 61%-17% margin.",other,,61.0,,,,online_panel,voters,,dfp;other;favorability,"Article: Democratic Voters Are Dissatisfied With Their Own Party, See No Clear Party Leader. Narrative polling finding."
DFP_20250328_0636,Data for Progress,https://www.dataforprogress.org/blog/2025/3/28/democratic-voters-are-dissatisfied-with-their-own-party-see-no-clear-party-leader,2025-03-28,oppose,"Additionally, 51% of Democratic voters say that Schumer does not have a clear, long-term strategy to oppose Trump.",other,,51.0,,,,online_panel,voters,,dfp;other;oppose,"Article: Democratic Voters Are Dissatisfied With Their Own Party, See No Clear Party Leader. Narrative polling finding."
DFP_20250328_0637,Data for Progress,https://www.dataforprogress.org/blog/2025/3/28/democratic-voters-are-dissatisfied-with-their-own-party-see-no-clear-party-leader,2025-03-28,opinion,"After being informed that Schumer voted for a spending package that some criticized as a “betrayal of the party’s principles,” a majority of Democratic voters (51%) say that Senate Democrats should choose a new leader.",other,,51.0,,,,online_panel,voters,,dfp;other;opinion,"Article: Democratic Voters Are Dissatisfied With Their Own Party, See No Clear Party Leader. Narrative polling finding."
DFP_20250328_0638,Data for Progress,https://www.dataforprogress.org/blog/2025/3/28/democratic-voters-are-dissatisfied-with-their-own-party-see-no-clear-party-leader,2025-03-28,opinion,"Only 34% say that Schumer should remain the Senate Democratic leader, while 15% are unsure.",other,,34.0,,,,online_panel,voters,,dfp;other;opinion,"Article: Democratic Voters Are Dissatisfied With Their Own Party, See No Clear Party Leader. Narrative polling finding."
DFP_20250328_0639,Data for Progress,https://www.dataforprogress.org/blog/2025/3/28/democratic-voters-are-dissatisfied-with-their-own-party-see-no-clear-party-leader,2025-03-28,opinion,"When asked which approach they would prefer a new Senate minority leader to take, 66% of Democratic voters say they want a leader who will fight harder against Trump and the Republican agenda, while only 14% say they want a leader who focuses on bipartisan compromise.",other,,66.0,,,,online_panel,voters,,dfp;other;opinion,"Article: Democratic Voters Are Dissatisfied With Their Own Party, See No Clear Party Leader. Narrative polling finding."
DFP_20250328_0640,Data for Progress,https://www.dataforprogress.org/blog/2025/3/28/democratic-voters-are-dissatisfied-with-their-own-party-see-no-clear-party-leader,2025-03-28,polling_finding,This includes a strong majority of Democratic voters both under 45 (72%) and 45 and over (67%).,other,,72.0,,,,online_panel,voters,,dfp;other;polling_finding,"Article: Democratic Voters Are Dissatisfied With Their Own Party, See No Clear Party Leader. Narrative polling finding."
DFP_20250328_0641,Data for Progress,https://www.dataforprogress.org/blog/2025/3/28/democratic-voters-are-dissatisfied-with-their-own-party-see-no-clear-party-leader,2025-03-28,support,"Additionally, Democratic voters support funding programs like health care and housing, even if it increases the deficit, by a 63%-34% margin.",healthcare,,63.0,,,,online_panel,voters,,dfp;healthcare;support,"Article: Democratic Voters Are Dissatisfied With Their Own Party, See No Clear Party Leader. Narrative polling finding."
DFP_20250328_0642,Data for Progress,https://www.dataforprogress.org/blog/2025/3/28/democratic-voters-are-dissatisfied-with-their-own-party-see-no-clear-party-leader,2025-03-28,priority,Nearly 3 in 4 Democratic voters (73%) say it is “very important” that Democrats emphasize how they will fight for the working class.,trade,,73.0,,,,online_panel,voters,,dfp;trade;priority,"Article: Democratic Voters Are Dissatisfied With Their Own Party, See No Clear Party Leader. Narrative polling finding."
DFP_20250328_0643,Data for Progress,https://www.dataforprogress.org/blog/2025/3/28/democratic-voters-are-dissatisfied-with-their-own-party-see-no-clear-party-leader,2025-03-28,priority,"A majority also say it is very important to take on corporate interests (68%), lower prices (62%), take on corruption in Washington (61%), and lay out a bold, progressive agenda (59%).",economy,,68.0,,,,online_panel,voters,,dfp;economy;priority,"Article: Democratic Voters Are Dissatisfied With Their Own Party, See No Clear Party Leader. Narrative polling finding."
DFP_20250328_0644,Data for Progress,https://www.dataforprogress.org/blog/2025/3/28/democratic-voters-are-dissatisfied-with-their-own-party-see-no-clear-party-leader,2025-03-28,support,Democratic voters are most favorable of leaders engaging in legal challenges to block Republican policies in court (81% support).,other,,81.0,,,,online_panel,voters,,dfp;other;support,"Article: Democratic Voters Are Dissatisfied With Their Own Party, See No Clear Party Leader. Narrative polling finding."
DFP_20250326_0645,Data for Progress,https://www.dataforprogress.org/blog/2025/3/26/cuomo-leads-nyc-mayors-race-with-39-mamdani-at-15-all-other-candidates-in-single-digits,2025-03-26,polling_finding,"Per the rules of the ranked choice voting system, if no candidate receives a majority of the votes (more than 50%) on the first ballot, the counting continues.",democracy,,50.0,,,854,online_panel,voters,,dfp;democracy;polling_finding,"Article: Cuomo Leads NYC Mayor’s Race With 39%, Mamdani at 15%, All Other Candidates in Single Digits. Narrative polling finding."
DFP_20250326_0646,Data for Progress,https://www.dataforprogress.org/blog/2025/3/26/cuomo-leads-nyc-mayors-race-with-39-mamdani-at-15-all-other-candidates-in-single-digits,2025-03-26,polling_finding,"Around this point in 2021, Andrew Yang led in public polling by double digits but ultimately finished fourth, with 12% of the vote.",other,,12.0,,,854,online_panel,voters,,dfp;other;polling_finding,"Article: Cuomo Leads NYC Mayor’s Race With 39%, Mamdani at 15%, All Other Candidates in Single Digits. Narrative polling finding."
DFP_20250325_0647,Data for Progress,https://www.dataforprogress.org/blog/2025/3/25/voters-oppose-the-trump-administrations-efforts-to-shutter-the-cfpb,2025-03-25,support,Congressional Republicans are also targeting a CFPB rule to keep medical debt off credit reports — a rule that previous Data for Progress polling found was supported by 81% of voters nationwide.,healthcare,,81.0,,,1172,online_panel,voters,,dfp;healthcare;support,Article: Voters Oppose the Trump Administration’s Efforts to Shutter the CFPB. Narrative polling finding.
DFP_20250325_0648,Data for Progress,https://www.dataforprogress.org/blog/2025/3/25/voters-oppose-the-trump-administrations-efforts-to-shutter-the-cfpb,2025-03-25,favorability,"While about half of voters (49%) haven’t heard enough to say, a majority of those who do have an opinion view the CFPB favorably (37% favorable, 15% unfavorable).",other,,49.0,,,1172,online_panel,voters,,dfp;other;favorability,Article: Voters Oppose the Trump Administration’s Efforts to Shutter the CFPB. Narrative polling finding.
DFP_20250325_0649,Data for Progress,https://www.dataforprogress.org/blog/2025/3/25/voters-oppose-the-trump-administrations-efforts-to-shutter-the-cfpb,2025-03-25,priority,"While a majority of voters view each item as “very important” or “somewhat important,” “protecting consumers from financial exploitation from banks and other financial companies” ranks second-highest, with an overwhelming 89% of voters viewing it as an important function.",trade,,89.0,,,1172,online_panel,voters,,dfp;trade;priority,Article: Voters Oppose the Trump Administration’s Efforts to Shutter the CFPB. Narrative polling finding.
DFP_20250325_0650,Data for Progress,https://www.dataforprogress.org/blog/2025/3/25/voters-oppose-the-trump-administrations-efforts-to-shutter-the-cfpb,2025-03-25,opinion,"A majority of voters believe regulations on the banking and financial sectors that are designed to protect consumer privacy, crack down on fraud, and prevent illegal account closures should be expanded (43%) or kept as they are (41%), while only 7% believe they should be cut.",technology,,43.0,,,1172,online_panel,voters,,dfp;technology;opinion,Article: Voters Oppose the Trump Administration’s Efforts to Shutter the CFPB. Narrative polling finding.
DFP_20250325_0651,Data for Progress,https://www.dataforprogress.org/blog/2025/3/25/voters-oppose-the-trump-administrations-efforts-to-shutter-the-cfpb,2025-03-25,oppose,"A majority of voters (51%), including a majority of Independents (57%), oppose these efforts to shutter the CFPB.",other,,51.0,,,1172,online_panel,voters,,dfp;other;oppose,Article: Voters Oppose the Trump Administration’s Efforts to Shutter the CFPB. Narrative polling finding.
DFP_20250325_0652,Data for Progress,https://www.dataforprogress.org/blog/2025/3/25/voters-want-their-government-to-address-the-property-insurance-crisis,2025-03-25,opinion,"On the subject of property insurance, 71% of voters say they have read or heard at least a little (50% have heard “a little,” while 21% have heard “a lot”) about recent changes impacting the property insurance industry in the U.S.",healthcare,,71.0,,,,online_panel,voters,,dfp;healthcare;opinion,Article: Voters Want Their Government to Address the Property Insurance Crisis. Narrative polling finding.
DFP_20250325_0653,Data for Progress,https://www.dataforprogress.org/blog/2025/3/25/voters-want-their-government-to-address-the-property-insurance-crisis,2025-03-25,concern,"A strong majority of voters are also concerned about future increases in the price of property insurance, with 78% of voters saying they are somewhat or very concerned.",healthcare,,78.0,,,,online_panel,voters,,dfp;healthcare;concern,Article: Voters Want Their Government to Address the Property Insurance Crisis. Narrative polling finding.
DFP_20250325_0654,Data for Progress,https://www.dataforprogress.org/blog/2025/3/25/voters-want-their-government-to-address-the-property-insurance-crisis,2025-03-25,concern,"Concerns are consistent across partisanship, and are higher among voters who report personally being impacted or knowing someone personally impacted by extreme weather (85%).",healthcare,,85.0,,,,online_panel,voters,,dfp;healthcare;concern,Article: Voters Want Their Government to Address the Property Insurance Crisis. Narrative polling finding.
DFP_20250325_0655,Data for Progress,https://www.dataforprogress.org/blog/2025/3/25/voters-want-their-government-to-address-the-property-insurance-crisis,2025-03-25,opinion,"When asked what forces they believe are driving these changes, voters place the most blame on insurance executives, with 85% of respondents saying they are at least somewhat responsible.",healthcare,,85.0,,,,online_panel,voters,,dfp;healthcare;opinion,Article: Voters Want Their Government to Address the Property Insurance Crisis. Narrative polling finding.
DFP_20250325_0656,Data for Progress,https://www.dataforprogress.org/blog/2025/3/25/voters-want-their-government-to-address-the-property-insurance-crisis,2025-03-25,polling_finding,"Furthermore, nearly half of voters rate these executives as being “very responsible” for recent spikes in insurance rates (46%).",healthcare,,46.0,,,,online_panel,voters,,dfp;healthcare;polling_finding,Article: Voters Want Their Government to Address the Property Insurance Crisis. Narrative polling finding.
DFP_20250325_0657,Data for Progress,https://www.dataforprogress.org/blog/2025/3/25/voters-want-their-government-to-address-the-property-insurance-crisis,2025-03-25,polling_finding,"However, voters also assign some responsibility to extreme weather due to climate change (37%) as well as to inflationary pressures facing the economy (36%).",economy,,37.0,,,,online_panel,voters,,dfp;economy;polling_finding,Article: Voters Want Their Government to Address the Property Insurance Crisis. Narrative polling finding.
DFP_20250325_0658,Data for Progress,https://www.dataforprogress.org/blog/2025/3/25/voters-want-their-government-to-address-the-property-insurance-crisis,2025-03-25,opinion,"Sixty-one percent of voters feel that the federal government is doing too little to ensure that home insurance companies are acting in their customers’ interests, while 52% and 50% of voters believe that their state government and their state insurance commissioner, respectively, are doing too little to hold these companies accountable.",healthcare,,52.0,,,,online_panel,voters,,dfp;healthcare;opinion,Article: Voters Want Their Government to Address the Property Insurance Crisis. Narrative polling finding.
DFP_20250325_0659,Data for Progress,https://www.dataforprogress.org/blog/2025/3/25/voters-want-their-government-to-address-the-property-insurance-crisis,2025-03-25,opinion,"In another signal that voters are feeling the impacts of climate change, more than half of voters (53%) say they have either personally been impacted by extreme weather events or know someone who has been personally impacted.",healthcare,,53.0,,,,online_panel,voters,,dfp;healthcare;opinion,Article: Voters Want Their Government to Address the Property Insurance Crisis. Narrative polling finding.
DFP_20250325_0660,Data for Progress,https://www.dataforprogress.org/blog/2025/3/25/voters-want-their-government-to-address-the-property-insurance-crisis,2025-03-25,concern,Two-thirds of voters (67%) say that they are somewhat or very concerned about the increasing frequency of extreme weather events in the future.,healthcare,,67.0,,,,online_panel,voters,,dfp;healthcare;concern,Article: Voters Want Their Government to Address the Property Insurance Crisis. Narrative polling finding.
DFP_20250325_0661,Data for Progress,https://www.dataforprogress.org/blog/2025/3/25/voters-want-their-government-to-address-the-property-insurance-crisis,2025-03-25,polling_finding,This includes 74% of voters who have either been personally impacted by extreme weather in the past or who know someone else who has been directly affected.,healthcare,,74.0,,,,online_panel,voters,,dfp;healthcare;polling_finding,Article: Voters Want Their Government to Address the Property Insurance Crisis. Narrative polling finding.
DFP_20250325_0662,Data for Progress,https://www.dataforprogress.org/blog/2025/3/25/voters-want-their-government-to-address-the-property-insurance-crisis,2025-03-25,concern,"Not only is this true across party lines, but also, voters are concerned regardless of their personal level of experience with extreme weather events, with 77% of those who know someone impacted and 65% of those who do not saying they are concerned.",healthcare,,77.0,,,,online_panel,voters,,dfp;healthcare;concern,Article: Voters Want Their Government to Address the Property Insurance Crisis. Narrative polling finding.
DFP_20250325_0663,Data for Progress,https://www.dataforprogress.org/blog/2025/3/25/voters-want-their-government-to-address-the-property-insurance-crisis,2025-03-25,likelihood,"In fact, nearly three-quarters of respondents (74%) say that it is “very likely” or “somewhat likely” that a breakdown in the property insurance market would affect them personally.",healthcare,,74.0,,,,online_panel,voters,,dfp;healthcare;likelihood,Article: Voters Want Their Government to Address the Property Insurance Crisis. Narrative polling finding.
DFP_20250325_0664,Data for Progress,https://www.dataforprogress.org/blog/2025/3/25/voters-want-their-government-to-address-the-property-insurance-crisis,2025-03-25,likelihood,"Once again, these results remain consistent across party lines and regardless of whether voters have been personally impacted by extreme weather events in the past, with 68% of unaffected respondents believing that the crisis is likely to impact them.",healthcare,,68.0,,,,online_panel,voters,,dfp;healthcare;likelihood,Article: Voters Want Their Government to Address the Property Insurance Crisis. Narrative polling finding.
DFP_20250325_0665,Data for Progress,https://www.dataforprogress.org/blog/2025/3/25/voters-want-their-government-to-address-the-property-insurance-crisis,2025-03-25,agreement,"They were then asked whether they agree or disagree with the claim that it is appropriate for insurance companies “to charge policyholders more when there is an increase in claims filed by other customers in the state.” Only 37% of voters agree that this is appropriate, while 57% of voters disagree.",healthcare,,37.0,,,,online_panel,voters,,dfp;healthcare;agreement,Article: Voters Want Their Government to Address the Property Insurance Crisis. Narrative polling finding.
DFP_20250325_0666,Data for Progress,https://www.dataforprogress.org/blog/2025/3/25/voters-want-their-government-to-address-the-property-insurance-crisis,2025-03-25,agreement,"This sentiment holds across party lines, with 56% of Democrats, 62% of Independents, and 53% of Republicans disagreeing.",healthcare,,56.0,,,,online_panel,voters,,dfp;healthcare;agreement,Article: Voters Want Their Government to Address the Property Insurance Crisis. Narrative polling finding.
DFP_20250324_0667,Data for Progress,https://www.dataforprogress.org/blog/2025/3/24/spending-today-to-save-tomorrow-voters-support-energy-efficiency,2025-03-24,polling_finding,"A bipartisan majority of voters are familiar with energy efficiency, with 68% somewhat or very familiar with the concept.",other,,68.0,,,1169,online_panel,voters,,dfp;other;polling_finding,Article: Spending Today to Save Tomorrow: Voters Support Energy Efficiency. Narrative polling finding.
DFP_20250324_0668,Data for Progress,https://www.dataforprogress.org/blog/2025/3/24/spending-today-to-save-tomorrow-voters-support-energy-efficiency,2025-03-24,polling_finding,"Energy efficiency is more salient among homeowners, with 72% reporting familiarity with it, compared with 61% of renters.",housing,,72.0,,,1169,online_panel,voters,,dfp;housing;polling_finding,Article: Spending Today to Save Tomorrow: Voters Support Energy Efficiency. Narrative polling finding.
DFP_20250324_0669,Data for Progress,https://www.dataforprogress.org/blog/2025/3/24/spending-today-to-save-tomorrow-voters-support-energy-efficiency,2025-03-24,polling_finding,"When asked which steps they have taken to improve energy efficiency in their home in the last three years, voters most often report switching to LED light bulbs (55%), resealing air leaks (35%), and installing energy-efficient appliances (26%).",other,,55.0,,,1169,online_panel,voters,,dfp;other;polling_finding,Article: Spending Today to Save Tomorrow: Voters Support Energy Efficiency. Narrative polling finding.
DFP_20250324_0670,Data for Progress,https://www.dataforprogress.org/blog/2025/3/24/spending-today-to-save-tomorrow-voters-support-energy-efficiency,2025-03-24,opinion,"Among voters who have taken at least one action to improve energy efficiency in their home, only 15% say they took advantage of tax credits or rebates, while 63% of respondents say they are unaware of any tax credits or rebates available to them.",economy,,15.0,,,1169,online_panel,voters,,dfp;economy;opinion,Article: Spending Today to Save Tomorrow: Voters Support Energy Efficiency. Narrative polling finding.
DFP_20250324_0671,Data for Progress,https://www.dataforprogress.org/blog/2025/3/24/spending-today-to-save-tomorrow-voters-support-energy-efficiency,2025-03-24,polling_finding,"Another 15% of respondents who’ve undertaken energy efficiency improvements report being aware of available tax credits or rebates, but did not take advantage of them.",economy,,15.0,,,1169,online_panel,voters,,dfp;economy;polling_finding,Article: Spending Today to Save Tomorrow: Voters Support Energy Efficiency. Narrative polling finding.
DFP_20250324_0672,Data for Progress,https://www.dataforprogress.org/blog/2025/3/24/spending-today-to-save-tomorrow-voters-support-energy-efficiency,2025-03-24,polling_finding,"When asked how motivated they would be to take advantage of tax credits or rebates, an overwhelming majority of voters (70%) are at least somewhat motivated to do so, including a majority of Independents (72%) and Republicans (67%).",economy,,70.0,,,1169,online_panel,voters,,dfp;economy;polling_finding,Article: Spending Today to Save Tomorrow: Voters Support Energy Efficiency. Narrative polling finding.
