poll_id,source,source_url,date,question_type,question_wording,topic,issue_area,support_pct,oppose_pct,net,sample_size,methodology,population,moe,tags,notes
DFP_20250917_0320,Data for Progress,https://www.dataforprogress.org/blog/2025/9/17/persuadable-voters-want-democrats-to-take-a-stand-against-republicans-in-the-upcoming-funding-fight-especially-on-health-care,2025-09-17,polling_finding,"SHUTDOWN RESPONSIBILITY If a government shutdown occurs on October 1, a majority of voters (59%) would place the blame on Trump (32%) or congressional Republicans (27%).",healthcare,,59.0,,,1226,online_panel,voters,,dfp;healthcare;polling_finding,"Article: Persuadable Voters Want Democrats to Take a Stand Against Republicans in the Upcoming Funding Fight, Especially on Health Care. Narrative polling finding."
DFP_20250917_0321,Data for Progress,https://www.dataforprogress.org/blog/2025/9/17/persuadable-voters-want-democrats-to-take-a-stand-against-republicans-in-the-upcoming-funding-fight-especially-on-health-care,2025-09-17,opinion,"Strong majorities of Democrats (66%) and Democratic-leaning Independents (73%), as well as a plurality of persuadable voters (47%), believe the Democratic Party is not doing enough to stand up to Trump and needs to fight harder.",healthcare,,47.0,,,1226,online_panel,voters,,dfp;healthcare;opinion,"Article: Persuadable Voters Want Democrats to Take a Stand Against Republicans in the Upcoming Funding Fight, Especially on Health Care. Narrative polling finding."
DFP_20250917_0322,Data for Progress,https://www.dataforprogress.org/blog/2025/9/17/persuadable-voters-want-democrats-to-take-a-stand-against-republicans-in-the-upcoming-funding-fight-especially-on-health-care,2025-09-17,opinion,"These key voting blocs also overwhelmingly believe that Democrats should fight against Trump even if they don’t win , including 79% of Democrats, 94% of Democratic-leaning Independents, and 61% of persuadable voters.",healthcare,,79.0,,,1226,online_panel,voters,,dfp;healthcare;opinion,"Article: Persuadable Voters Want Democrats to Take a Stand Against Republicans in the Upcoming Funding Fight, Especially on Health Care. Narrative polling finding."
DFP_20250917_0323,Data for Progress,https://www.dataforprogress.org/blog/2025/9/17/persuadable-voters-want-democrats-to-take-a-stand-against-republicans-in-the-upcoming-funding-fight-especially-on-health-care,2025-09-17,agreement,"After being presented with this information and asked how Democrats should respond, a majority of voters in Democrats’ key voting blocs say “Democrats should withhold their votes unless Republicans agree to changes, even if that risks a government shutdown,” including Democrats (70%), Democratic-leaning Independents (77%), and persuadable voters (51%).",healthcare,,51.0,,,1226,online_panel,voters,,dfp;healthcare;agreement,"Article: Persuadable Voters Want Democrats to Take a Stand Against Republicans in the Upcoming Funding Fight, Especially on Health Care. Narrative polling finding."
DFP_20250915_0324,Data for Progress,https://www.dataforprogress.org/blog/2025/9/15/voters-report-rising-climate-impacts-and-strongly-support-making-polluters-pay,2025-09-15,opinion,"When asked about extreme weather, nearly half of voters (45%) report that they or someone they know personally has experienced extreme heat waves in the last five years, while about 3 in 10 say the same about flooding or flash flooding.",climate,,45.0,,,2372,online_panel,voters,,dfp;climate;opinion,Article: Voters Report Rising Climate Impacts and Strongly Support Making Polluters Pay. Narrative polling finding.
DFP_20250915_0325,Data for Progress,https://www.dataforprogress.org/blog/2025/9/15/voters-report-rising-climate-impacts-and-strongly-support-making-polluters-pay,2025-09-15,opinion,"In an A/B split sample, one group of voters was asked whether extreme weather events have increased, decreased, or stayed the same in the past five years; around two-thirds (65%) say such events have increased.",climate,,65.0,,,2372,online_panel,voters,,dfp;climate;opinion,Article: Voters Report Rising Climate Impacts and Strongly Support Making Polluters Pay. Narrative polling finding.
DFP_20250915_0326,Data for Progress,https://www.dataforprogress.org/blog/2025/9/15/voters-report-rising-climate-impacts-and-strongly-support-making-polluters-pay,2025-09-15,concern,"The survey also finds that a strong majority of voters (84%) say they are concerned about rising home and property insurance rates in the coming years — a bipartisan sentiment, with 91% of Democrats, 85% of Independents, and 78% of Republicans expressing concern.",healthcare,,84.0,,,2372,online_panel,voters,,dfp;healthcare;concern,Article: Voters Report Rising Climate Impacts and Strongly Support Making Polluters Pay. Narrative polling finding.
DFP_20250915_0327,Data for Progress,https://www.dataforprogress.org/blog/2025/9/15/voters-report-rising-climate-impacts-and-strongly-support-making-polluters-pay,2025-09-15,concern,"These findings mark an uptick in concern when compared with a similar question asked in a March 2025 poll, where 78% of voters said they were concerned about future increases in insurance rates.",healthcare,,78.0,,,2372,online_panel,voters,,dfp;healthcare;concern,Article: Voters Report Rising Climate Impacts and Strongly Support Making Polluters Pay. Narrative polling finding.
DFP_20250915_0328,Data for Progress,https://www.dataforprogress.org/blog/2025/9/15/voters-report-rising-climate-impacts-and-strongly-support-making-polluters-pay,2025-09-15,opinion,"Looking more broadly, a majority of voters believe both climate change (56%) and fossil fuel pollution (52%) will directly affect their household finances, views consistent with an earlier poll from this year.",climate,,56.0,,,2372,online_panel,voters,,dfp;climate;opinion,Article: Voters Report Rising Climate Impacts and Strongly Support Making Polluters Pay. Narrative polling finding.
DFP_20250915_0329,Data for Progress,https://www.dataforprogress.org/blog/2025/9/15/voters-report-rising-climate-impacts-and-strongly-support-making-polluters-pay,2025-09-15,likelihood,"In bluer states like Illinois and Virginia, voters are far more likely to expect financial impact; two-thirds in Illinois (66%) and nearly 3 in 5 in Virginia (59%) say climate change will affect their household finances.",climate,,66.0,,,2372,online_panel,voters,,dfp;climate;likelihood,Article: Voters Report Rising Climate Impacts and Strongly Support Making Polluters Pay. Narrative polling finding.
DFP_20250915_0330,Data for Progress,https://www.dataforprogress.org/blog/2025/9/15/voters-report-rising-climate-impacts-and-strongly-support-making-polluters-pay,2025-09-15,polling_finding,"Among voters who do expect financial effects, large majorities point to higher utility bills (73%), grocery bills (68%), and gas prices (65%).",economy,,73.0,,,2372,online_panel,voters,,dfp;economy;polling_finding,Article: Voters Report Rising Climate Impacts and Strongly Support Making Polluters Pay. Narrative polling finding.
DFP_20250915_0331,Data for Progress,https://www.dataforprogress.org/blog/2025/9/15/voters-report-rising-climate-impacts-and-strongly-support-making-polluters-pay,2025-09-15,support,"Roughly three-quarters of voters (74%) support requiring oil and gas companies to pay a share of climate-related costs, including 86% of Democrats, 74% of Independents, and 61% of Republicans.",climate,,74.0,,,2372,online_panel,voters,,dfp;climate;support,Article: Voters Report Rising Climate Impacts and Strongly Support Making Polluters Pay. Narrative polling finding.
DFP_20250915_0332,Data for Progress,https://www.dataforprogress.org/blog/2025/9/15/voters-report-rising-climate-impacts-and-strongly-support-making-polluters-pay,2025-09-15,support,"These findings are also consistent with polling from the spring, when 71% of voters supported such a requirement, underscoring broad and stable support for holding fossil fuel polluters accountable.",climate,,71.0,,,2372,online_panel,voters,,dfp;climate;support,Article: Voters Report Rising Climate Impacts and Strongly Support Making Polluters Pay. Narrative polling finding.
DFP_20250915_0333,Data for Progress,https://www.dataforprogress.org/blog/2025/9/15/voters-report-rising-climate-impacts-and-strongly-support-making-polluters-pay,2025-09-15,opinion,"Nearly 4 in 5 voters (79%) say oil and gas companies should be required to pay for climate damages, including 88% of Democrats, 80% of Independents, and 69% of Republicans.",climate,,79.0,,,2372,online_panel,voters,,dfp;climate;opinion,Article: Voters Report Rising Climate Impacts and Strongly Support Making Polluters Pay. Narrative polling finding.
DFP_20250915_0334,Data for Progress,https://www.dataforprogress.org/blog/2025/9/15/voters-report-rising-climate-impacts-and-strongly-support-making-polluters-pay,2025-09-15,support,"Under the cost-sharing frame, 77% of voters express support, including 89% of Democrats, 78% of Independents, and 64% of Republicans.",climate,,77.0,,,2372,online_panel,voters,,dfp;climate;support,Article: Voters Report Rising Climate Impacts and Strongly Support Making Polluters Pay. Narrative polling finding.
DFP_20250915_0335,Data for Progress,https://www.dataforprogress.org/blog/2025/9/15/voters-report-rising-climate-impacts-and-strongly-support-making-polluters-pay,2025-09-15,support,"Under the recovery fund frame, support remains nearly identical at 78% overall, and 89%, 80%, and 66% among Democrats, Independents, and Republicans, respectively.",climate,,78.0,,,2372,online_panel,voters,,dfp;climate;support,Article: Voters Report Rising Climate Impacts and Strongly Support Making Polluters Pay. Narrative polling finding.
DFP_20250915_0336,Data for Progress,https://www.dataforprogress.org/blog/2025/9/15/voters-report-rising-climate-impacts-and-strongly-support-making-polluters-pay,2025-09-15,support,"In both Illinois and North Carolina, 78% of voters back the recovery fund framing, while support in Florida (75%), Texas (73%), and Virginia (79%) is also strong.",climate,,78.0,,,2372,online_panel,voters,,dfp;climate;support,Article: Voters Report Rising Climate Impacts and Strongly Support Making Polluters Pay. Narrative polling finding.
DFP_20250915_0337,Data for Progress,https://www.dataforprogress.org/blog/2025/9/15/voters-report-rising-climate-impacts-and-strongly-support-making-polluters-pay,2025-09-15,support,"Under the cost-sharing framing, support is highest in Florida (80%) and Texas (78%), with majorities in all oversampled states backing the measure.",climate,,80.0,,,2372,online_panel,voters,,dfp;climate;support,Article: Voters Report Rising Climate Impacts and Strongly Support Making Polluters Pay. Narrative polling finding.
DFP_20250915_0338,Data for Progress,https://www.dataforprogress.org/blog/2025/9/15/voters-report-rising-climate-impacts-and-strongly-support-making-polluters-pay,2025-09-15,support,"Across both split sample groups, there is a marked increase in climate superfund support when compared with polling from 2024, when 66% of voters said they would support a ""climate superfund"" bill that would require oil and gas companies to pay a share of the cost of climate damages caused by their pollution.",climate,,66.0,,,2372,online_panel,voters,,dfp;climate;support,Article: Voters Report Rising Climate Impacts and Strongly Support Making Polluters Pay. Narrative polling finding.
DFP_20250915_0339,Data for Progress,https://www.dataforprogress.org/blog/2025/9/15/voters-report-rising-climate-impacts-and-strongly-support-making-polluters-pay,2025-09-15,support,"Sixty-one percent report they would be more likely to support a candidate who backed such a measure, compared with just 16% who say they would be less likely.",climate,,16.0,,,2372,online_panel,voters,,dfp;climate;support,Article: Voters Report Rising Climate Impacts and Strongly Support Making Polluters Pay. Narrative polling finding.
DFP_20250915_0340,Data for Progress,https://www.dataforprogress.org/blog/2025/9/15/voters-report-rising-climate-impacts-and-strongly-support-making-polluters-pay,2025-09-15,support,"Compared with April 2024, when 50% of voters said they would be more likely to support a candidate who backed a superfund bill and 22% said they would be less likely, the latest results point to a clear increase in support.",climate,,50.0,,,2372,online_panel,voters,,dfp;climate;support,Article: Voters Report Rising Climate Impacts and Strongly Support Making Polluters Pay. Narrative polling finding.
DFP_20250915_0341,Data for Progress,https://www.dataforprogress.org/blog/2025/9/15/voters-report-rising-climate-impacts-and-strongly-support-making-polluters-pay,2025-09-15,oppose,"Finally, the survey also finds that 65% of voters overall oppose granting legal immunity to oil and gas companies, which would shield them from being sued for damages related to climate disasters.",climate,,65.0,,,2372,online_panel,voters,,dfp;climate;oppose,Article: Voters Report Rising Climate Impacts and Strongly Support Making Polluters Pay. Narrative polling finding.
DFP_20250915_0342,Data for Progress,https://www.dataforprogress.org/blog/2025/9/15/voters-report-rising-climate-impacts-and-strongly-support-making-polluters-pay,2025-09-15,oppose,"This mirrors findings from a March 2025 survey, where 65% of voters also opposed immunity, underscoring that voter opposition to protections for polluters remains steady.",climate,,65.0,,,2372,online_panel,voters,,dfp;climate;oppose,Article: Voters Report Rising Climate Impacts and Strongly Support Making Polluters Pay. Narrative polling finding.
DFP_20250915_0343,Data for Progress,https://www.dataforprogress.org/blog/2025/9/15/voters-are-turning-to-statehouses-for-leadership,2025-09-15,trust,"We find that a plurality of respondents (47%) report that they trust elected officials in the state legislature “somewhat” or “a great deal,” while only around a third of respondents say the same for elected officials nationally (34%).",government,,47.0,,,1196,online_panel,voters,,dfp;government;trust,Article: Voters Are Turning to Statehouses for Leadership. Narrative polling finding.
DFP_20250915_0344,Data for Progress,https://www.dataforprogress.org/blog/2025/9/15/voters-are-turning-to-statehouses-for-leadership,2025-09-15,concern,"When asked who they believe is more focused on their everyday needs and concerns, 57% of respondents think that the state government is more focused than is the federal government.",government,,57.0,,,1196,online_panel,voters,,dfp;government;concern,Article: Voters Are Turning to Statehouses for Leadership. Narrative polling finding.
DFP_20250915_0345,Data for Progress,https://www.dataforprogress.org/blog/2025/9/15/voters-are-turning-to-statehouses-for-leadership,2025-09-15,polling_finding,"This finding holds at both the state and federal level, with pluralities of respondents believing that both congressional and state Democrats care more about them (46% and 44%, respectively) than do their Republican counterparts.",government,,46.0,,,1196,online_panel,voters,,dfp;government;polling_finding,Article: Voters Are Turning to Statehouses for Leadership. Narrative polling finding.
DFP_20250915_0346,Data for Progress,https://www.dataforprogress.org/blog/2025/9/15/voters-are-turning-to-statehouses-for-leadership,2025-09-15,support,"Among the highest performing policies are requiring utility companies to invest in grid modernization (87% support), updating educational standards for advancing students (85% support), and prohibiting companies from charging hidden fees and junk fees (83% support).",education,,87.0,,,1196,online_panel,voters,,dfp;education;support,Article: Voters Are Turning to Statehouses for Leadership. Narrative polling finding.
DFP_20250910_0347,Data for Progress,https://www.dataforprogress.org/blog/2025/9/10/voters-disapprove-of-trumps-handling-of-inflation-but-are-even-less-confident-in-democrats-to-have-a-solution,2025-09-10,opinion,"A plurality of voters (32%) say that “economy, jobs, and inflation” is the issue they consider the most when deciding which candidate to vote for.",economy,,32.0,,,1202,online_panel,voters,,dfp;economy;opinion,"Article: Voters Disapprove of Trump’s Handling of Inflation, but Are Even Less Confident in Democrats to Have a Solution. Narrative polling finding."
DFP_20250910_0348,Data for Progress,https://www.dataforprogress.org/blog/2025/9/10/voters-disapprove-of-trumps-handling-of-inflation-but-are-even-less-confident-in-democrats-to-have-a-solution,2025-09-10,polling_finding,"Since October 2024, the economy has consistently been selected as the top issue by about 30% of voters.",economy,,30.0,,,1202,online_panel,voters,,dfp;economy;polling_finding,"Article: Voters Disapprove of Trump’s Handling of Inflation, but Are Even Less Confident in Democrats to Have a Solution. Narrative polling finding."
DFP_20250910_0349,Data for Progress,https://www.dataforprogress.org/blog/2025/9/10/voters-disapprove-of-trumps-handling-of-inflation-but-are-even-less-confident-in-democrats-to-have-a-solution,2025-09-10,concern,"While inflation remains voters’ top economic concern, its prevalence has declined from an average of about 55% before the 2024 election.",economy,,55.0,,,1202,online_panel,voters,,dfp;economy;concern,"Article: Voters Disapprove of Trump’s Handling of Inflation, but Are Even Less Confident in Democrats to Have a Solution. Narrative polling finding."
DFP_20250910_0350,Data for Progress,https://www.dataforprogress.org/blog/2025/9/10/voters-disapprove-of-trumps-handling-of-inflation-but-are-even-less-confident-in-democrats-to-have-a-solution,2025-09-10,opinion,"Notably, a strong majority of voters (72%), including 73% of Independents, say inflation is getting worse for people like them, and a majority of voters (61%) say the same about the economy in general.",economy,,72.0,,,1202,online_panel,voters,,dfp;economy;opinion,"Article: Voters Disapprove of Trump’s Handling of Inflation, but Are Even Less Confident in Democrats to Have a Solution. Narrative polling finding."
DFP_20250910_0351,Data for Progress,https://www.dataforprogress.org/blog/2025/9/10/voters-disapprove-of-trumps-handling-of-inflation-but-are-even-less-confident-in-democrats-to-have-a-solution,2025-09-10,opinion,"Furthermore, around half of voters say wages or salaries (50%), job security (47%), and the availability of jobs (46%) are getting worse for people like them — including pluralities of Independents across the board.",economy,,50.0,,,1202,online_panel,voters,,dfp;economy;opinion,"Article: Voters Disapprove of Trump’s Handling of Inflation, but Are Even Less Confident in Democrats to Have a Solution. Narrative polling finding."
DFP_20250910_0352,Data for Progress,https://www.dataforprogress.org/blog/2025/9/10/voters-disapprove-of-trumps-handling-of-inflation-but-are-even-less-confident-in-democrats-to-have-a-solution,2025-09-10,disapproval,"Today, 55% of voters disapprove of Trump’s handling of inflation, while just 42% approve.",economy,,55.0,,,1202,online_panel,voters,,dfp;economy;disapproval,"Article: Voters Disapprove of Trump’s Handling of Inflation, but Are Even Less Confident in Democrats to Have a Solution. Narrative polling finding."
DFP_20250910_0353,Data for Progress,https://www.dataforprogress.org/blog/2025/9/10/voters-disapprove-of-trumps-handling-of-inflation-but-are-even-less-confident-in-democrats-to-have-a-solution,2025-09-10,polling_finding,"At least 70% of voters attribute “some” or “a great deal” of responsibility to these perceived sources of inflation in the past year: government spending (74% blame), corporate price gouging (74%), tariffs on goods imported into the U.S.",economy,,70.0,,,1202,online_panel,voters,,dfp;economy;polling_finding,"Article: Voters Disapprove of Trump’s Handling of Inflation, but Are Even Less Confident in Democrats to Have a Solution. Narrative polling finding."
DFP_20250910_0354,Data for Progress,https://www.dataforprogress.org/blog/2025/9/10/voters-disapprove-of-trumps-handling-of-inflation-but-are-even-less-confident-in-democrats-to-have-a-solution,2025-09-10,opinion,"When it comes to the policies of Trump and former President Joe Biden, voters attribute similar levels of blame, with 62% saying Trump’s policies are responsible, and 59% saying the same about Biden’s policies.",economy,,62.0,,,1202,online_panel,voters,,dfp;economy;opinion,"Article: Voters Disapprove of Trump’s Handling of Inflation, but Are Even Less Confident in Democrats to Have a Solution. Narrative polling finding."
DFP_20250910_0355,Data for Progress,https://www.dataforprogress.org/blog/2025/9/10/voters-disapprove-of-trumps-handling-of-inflation-but-are-even-less-confident-in-democrats-to-have-a-solution,2025-09-10,polling_finding,"In late January, 32% of voters said Trump’s policies contributed a great deal.",economy,,32.0,,,1202,online_panel,voters,,dfp;economy;polling_finding,"Article: Voters Disapprove of Trump’s Handling of Inflation, but Are Even Less Confident in Democrats to Have a Solution. Narrative polling finding."
DFP_20250910_0356,Data for Progress,https://www.dataforprogress.org/blog/2025/9/10/voters-disapprove-of-trumps-handling-of-inflation-but-are-even-less-confident-in-democrats-to-have-a-solution,2025-09-10,opinion,"Today, 45% of voters say Trump’s policies have contributed a great deal to inflation.",economy,,45.0,,,1202,online_panel,voters,,dfp;economy;opinion,"Article: Voters Disapprove of Trump’s Handling of Inflation, but Are Even Less Confident in Democrats to Have a Solution. Narrative polling finding."
DFP_20250910_0357,Data for Progress,https://www.dataforprogress.org/blog/2025/9/10/voters-disapprove-of-trumps-handling-of-inflation-but-are-even-less-confident-in-democrats-to-have-a-solution,2025-09-10,polling_finding,Voters are more confident that Trump (39%) and the Republican Party (35%) have a solution for inflation than the Democratic Party (29%).,economy,,39.0,,,1202,online_panel,voters,,dfp;economy;polling_finding,"Article: Voters Disapprove of Trump’s Handling of Inflation, but Are Even Less Confident in Democrats to Have a Solution. Narrative polling finding."
DFP_20250910_0358,Data for Progress,https://www.dataforprogress.org/blog/2025/9/10/voters-disapprove-of-trumps-handling-of-inflation-but-are-even-less-confident-in-democrats-to-have-a-solution,2025-09-10,opinion,"While 37% of persuadable voters believe Trump has a solution for inflation and 32% believe the Republican Party does, only 21% of persuadable voters believe the Democratic Party has a solution for inflation.",economy,,37.0,,,1202,online_panel,voters,,dfp;economy;opinion,"Article: Voters Disapprove of Trump’s Handling of Inflation, but Are Even Less Confident in Democrats to Have a Solution. Narrative polling finding."
DFP_20250909_0359,Data for Progress,https://www.dataforprogress.org/blog/2025/9/9/voters-broadly-trust-vaccines-do-not-approve-of-florida-eliminating-its-vaccine-mandate,2025-09-09,opinion,"When asked whether the COVID-19 vaccine should be available to anyone who wants it or only to those at higher risk, more than 3 in 4 voters (77%) say the vaccine should be widely available.",other,,77.0,,,1226,online_panel,voters,,dfp;other;opinion,"Article: Voters Broadly Trust Vaccines, Do Not Approve of Florida Eliminating Its Vaccine Mandate. Narrative polling finding."
DFP_20250909_0360,Data for Progress,https://www.dataforprogress.org/blog/2025/9/9/voters-broadly-trust-vaccines-do-not-approve-of-florida-eliminating-its-vaccine-mandate,2025-09-09,support_oppose_pair,"While only 19% of voters oppose requiring vaccines in public schools, 32% of voters say they support Florida’s decision to end all vaccine mandates — a jump in support largely driven by Republican voters.",education,,19.0,,,1226,online_panel,voters,,dfp;education;support_oppose_pair,"Article: Voters Broadly Trust Vaccines, Do Not Approve of Florida Eliminating Its Vaccine Mandate. Narrative polling finding."
DFP_20250909_0361,Data for Progress,https://www.dataforprogress.org/blog/2025/9/9/voters-broadly-trust-vaccines-do-not-approve-of-florida-eliminating-its-vaccine-mandate,2025-09-09,oppose,The decision is still opposed by 63% of voters overall.,other,,63.0,,,1226,online_panel,voters,,dfp;other;oppose,"Article: Voters Broadly Trust Vaccines, Do Not Approve of Florida Eliminating Its Vaccine Mandate. Narrative polling finding."
DFP_20250909_0362,Data for Progress,https://www.dataforprogress.org/blog/2025/9/9/voters-broadly-trust-vaccines-do-not-approve-of-florida-eliminating-its-vaccine-mandate,2025-09-09,oppose,"A majority of voters oppose this move, including 84% of Democrats and 57% of Independents.",other,,84.0,,,1226,online_panel,voters,,dfp;other;oppose,"Article: Voters Broadly Trust Vaccines, Do Not Approve of Florida Eliminating Its Vaccine Mandate. Narrative polling finding."
DFP_20250908_0363,Data for Progress,https://www.dataforprogress.org/blog/2025/9/8/most-voters-are-unaware-of-construction-of-data-centers-in-their-state-and-the-environmental-impacts-they-cause,2025-09-08,opinion,Nearly half of voters (45%) say they haven’t heard enough to formulate an opinion on data centers.,climate,,45.0,,,1179,online_panel,voters,,dfp;climate;opinion,Article: Most Voters Are Unaware of the Construction of Data Centers in Their State and the Environmental Impacts They Cause. Narrative polling finding.
