poll_id,source,source_url,date,question_type,question_wording,topic,issue_area,support_pct,oppose_pct,net,sample_size,methodology,population,moe,tags,notes
DFP_20260504_0001,Data for Progress,https://www.dataforprogress.org/blog/2026/5/4/prince-georges-countys-democratic-primary-voters-see-room-for-improvement-on-housing-related-issues,2026-05-04,disapproval,"Most respondents disapprove of how the County Council has handled the cost of living, especially those under the age of 45 (66%) and renters (59%).",economy,,59.0,,,389,online_panel,voters,,dfp;economy;disapproval,Article: Prince George’s County’s Democratic Primary Voters See Room for Improvement On Housing-Related Issues. Narrative polling finding.
DFP_20260504_0002,Data for Progress,https://www.dataforprogress.org/blog/2026/5/4/prince-georges-countys-democratic-primary-voters-see-room-for-improvement-on-housing-related-issues,2026-05-04,polling_finding,"But despite that disapproval, only about a quarter of Democratic primary voters in Prince George’s County have written to their County Council member about local issues, while the vast majority (73%) have not.",housing,,73.0,,,389,online_panel,voters,,dfp;housing;polling_finding,Article: Prince George’s County’s Democratic Primary Voters See Room for Improvement On Housing-Related Issues. Narrative polling finding.
DFP_20260504_0003,Data for Progress,https://www.dataforprogress.org/blog/2026/5/4/prince-georges-countys-democratic-primary-voters-see-room-for-improvement-on-housing-related-issues,2026-05-04,priority,Most respondents (57%) say it is more important to lower housing costs than to preserve neighborhood character.,economy,,57.0,,,389,online_panel,voters,,dfp;economy;priority,Article: Prince George’s County’s Democratic Primary Voters See Room for Improvement On Housing-Related Issues. Narrative polling finding.
DFP_20260504_0004,Data for Progress,https://www.dataforprogress.org/blog/2026/5/4/prince-georges-countys-democratic-primary-voters-see-room-for-improvement-on-housing-related-issues,2026-05-04,likelihood,"Younger voters (73%) and renters (64%) are even more likely to prioritize lower housing costs, and a majority of homeowners (52%) say the same.",economy,,73.0,,,389,online_panel,voters,,dfp;economy;likelihood,Article: Prince George’s County’s Democratic Primary Voters See Room for Improvement On Housing-Related Issues. Narrative polling finding.
DFP_20260504_0005,Data for Progress,https://www.dataforprogress.org/blog/2026/5/4/prince-georges-countys-democratic-primary-voters-see-room-for-improvement-on-housing-related-issues,2026-05-04,opinion,"Most Democratic primary voters see the age and quality of housing in the county as either a minor (42%) or major (32%) issue, with only one-fifth saying it is not really an issue at all.",housing,,42.0,,,389,online_panel,voters,,dfp;housing;opinion,Article: Prince George’s County’s Democratic Primary Voters See Room for Improvement On Housing-Related Issues. Narrative polling finding.
DFP_20260504_0006,Data for Progress,https://www.dataforprogress.org/blog/2026/5/4/prince-georges-countys-democratic-primary-voters-see-room-for-improvement-on-housing-related-issues,2026-05-04,support,"By a +2-point margin, these voters say they would be more likely to vote for a councilor who supports new housing in their neighborhood, while 23% say it would make no difference in their vote.",housing,,23.0,,,389,online_panel,voters,,dfp;housing;support,Article: Prince George’s County’s Democratic Primary Voters See Room for Improvement On Housing-Related Issues. Narrative polling finding.
DFP_20260504_0007,Data for Progress,https://www.dataforprogress.org/blog/2026/5/4/prince-georges-countys-democratic-primary-voters-see-room-for-improvement-on-housing-related-issues,2026-05-04,likelihood,"A plurality of younger voters (40%) and renters (41%) are more likely to vote for such a candidate, while homeowners say they are less likely to do so, by a -3-point net margin.",housing,,41.0,,,389,online_panel,voters,,dfp;housing;likelihood,Article: Prince George’s County’s Democratic Primary Voters See Room for Improvement On Housing-Related Issues. Narrative polling finding.
DFP_20260504_0008,Data for Progress,https://www.dataforprogress.org/blog/2026/5/4/prince-georges-countys-democratic-primary-voters-see-room-for-improvement-on-housing-related-issues,2026-05-04,polling_finding,"Democratic primary voters are more comfortable with new housing the farther away it’s built, with at least 3 in 5 voters somewhat or very comfortable having new housing built in their ZIP code (60%), elsewhere in the county (73%), or outside the county (69%).",housing,,60.0,,,389,online_panel,voters,,dfp;housing;polling_finding,Article: Prince George’s County’s Democratic Primary Voters See Room for Improvement On Housing-Related Issues. Narrative polling finding.
DFP_20260504_0009,Data for Progress,https://www.dataforprogress.org/blog/2026/5/4/prince-georges-countys-democratic-primary-voters-see-room-for-improvement-on-housing-related-issues,2026-05-04,polling_finding,"These voters are less comfortable (a little or not comfortable at all) about new housing on their block (56%), and they are split on housing in their neighborhood or subdivision.",housing,,56.0,,,389,online_panel,voters,,dfp;housing;polling_finding,Article: Prince George’s County’s Democratic Primary Voters See Room for Improvement On Housing-Related Issues. Narrative polling finding.
DFP_20260430_0010,Data for Progress,https://www.dataforprogress.org/blog/2026/4/30/voters-say-their-top-priority-in-the-iran-war-is-ending-it,2026-04-30,opinion,"In a new survey , Data for Progress finds that a majority of voters (52%) — including 60% of Independents — think the U.S.",foreign_policy,,52.0,,,1167,online_panel,voters,,dfp;foreign_policy;opinion,Article: Voters Say Their Top Priority in the Iran War Is Ending It. Narrative polling finding.
DFP_20260430_0011,Data for Progress,https://www.dataforprogress.org/blog/2026/4/30/voters-say-their-top-priority-in-the-iran-war-is-ending-it,2026-04-30,opinion,Only 35% of voters think the U.S.,foreign_policy,,35.0,,,1167,online_panel,voters,,dfp;foreign_policy;opinion,Article: Voters Say Their Top Priority in the Iran War Is Ending It. Narrative polling finding.
DFP_20260430_0012,Data for Progress,https://www.dataforprogress.org/blog/2026/4/30/voters-say-their-top-priority-in-the-iran-war-is-ending-it,2026-04-30,opinion,A plurality of voters (39%) — including 56% of Democrats and 42% of Independents — say the main goal should be to “end the war as soon as possible.” About 1 in 4 voters (23%) — including a plurality of Republicans (36%) — think the top goal should be to prevent Iran from possessing a nuclear weapon.,foreign_policy,,39.0,,,1167,online_panel,voters,,dfp;foreign_policy;opinion,Article: Voters Say Their Top Priority in the Iran War Is Ending It. Narrative polling finding.
DFP_20260430_0013,Data for Progress,https://www.dataforprogress.org/blog/2026/4/30/voters-say-their-top-priority-in-the-iran-war-is-ending-it,2026-04-30,polling_finding,"Smaller percentages prioritize reopening the Strait of Hormuz (13%), dismantling Iran’s regional military network (11%), and changing the Iranian regime to a more U.S.-aligned government (7%).",foreign_policy,,13.0,,,1167,online_panel,voters,,dfp;foreign_policy;polling_finding,Article: Voters Say Their Top Priority in the Iran War Is Ending It. Narrative polling finding.
DFP_20260429_0014,Data for Progress,https://www.dataforprogress.org/blog/2026/4/29/voters-support-multiple-pro-worker-measures-to-regulate-ai,2026-04-29,trust,The only tested group that a majority of voters trust is labor unions (59%).,labor,,59.0,,,1085,online_panel,voters,,dfp;labor;trust,Article: Voters Support Multiple Pro-Worker Measures to Regulate AI. Narrative polling finding.
DFP_20260429_0015,Data for Progress,https://www.dataforprogress.org/blog/2026/4/29/voters-support-multiple-pro-worker-measures-to-regulate-ai,2026-04-29,trust,"Less than half of voters trust Democrats (48%), Republicans (45%), corporations (36%), and politicians (27%).",labor,,36.0,,,1085,online_panel,voters,,dfp;labor;trust,Article: Voters Support Multiple Pro-Worker Measures to Regulate AI. Narrative polling finding.
DFP_20260429_0016,Data for Progress,https://www.dataforprogress.org/blog/2026/4/29/voters-support-multiple-pro-worker-measures-to-regulate-ai,2026-04-29,trust,"A plurality of voters (27%) — including a plurality of Independents (36%) — trust labor unions most to protect workers from AI, followed by Democrats (23%), Republicans (19%), and employers (12%).",labor,,27.0,,,1085,online_panel,voters,,dfp;labor;trust,Article: Voters Support Multiple Pro-Worker Measures to Regulate AI. Narrative polling finding.
DFP_20260429_0017,Data for Progress,https://www.dataforprogress.org/blog/2026/4/29/voters-support-a-progressive-agenda-focused-on-lowering-costs-and-taking-on-corporations,2026-04-29,support,Requiring two weeks of paid time off for all full-time workers and restricting private utility companies from passing unreasonable costs on to customers are the most popular policies on the list — each earning support from 79% of voters.,labor,,79.0,,,1085,online_panel,voters,,dfp;labor;support,Article: Voters Support a Progressive Agenda Focused on Lowering Costs and Taking on Corporations. Narrative polling finding.
DFP_20260429_0018,Data for Progress,https://www.dataforprogress.org/blog/2026/4/29/voters-support-a-progressive-agenda-focused-on-lowering-costs-and-taking-on-corporations,2026-04-29,support,"Voters also show strong support for reducing corporate control over seed patents (75% support), capping super PAC donations (71%), banning artificial intelligence from setting prices or wages based on personal data (70%), and enabling federal generic drug manufacturing (70%).",economy,,75.0,,,1085,online_panel,voters,,dfp;economy;support,Article: Voters Support a Progressive Agenda Focused on Lowering Costs and Taking on Corporations. Narrative polling finding.
DFP_20260429_0019,Data for Progress,https://www.dataforprogress.org/blog/2026/4/29/voters-support-a-progressive-agenda-focused-on-lowering-costs-and-taking-on-corporations,2026-04-29,support,"Policies that earn support from at least 65% of voters also include taxing unusually high oil company profits to provide a gas rebate (69% support), raising overtime pay (69%), investing $1 trillion in affordable housing (66%), cracking down on grocery store price gouging (65%), and capping childcare costs (65%).",economy,,65.0,,,1085,online_panel,voters,,dfp;economy;support,Article: Voters Support a Progressive Agenda Focused on Lowering Costs and Taking on Corporations. Narrative polling finding.
DFP_20260427_0020,Data for Progress,https://www.dataforprogress.org/blog/2026/4/27/voters-prefer-cooperating-over-competing-with-china-to-enable-faster-progress-on-clean-energy-technologies,2026-04-27,favorability,"voters have an unfavorable view of China, with only 25% expressing a favorable opinion and 62% expressing an unfavorable one.",climate,,25.0,,,1213,online_panel,voters,,dfp;climate;favorability,Article: Voters Prefer Cooperating Over Competing With China to Enable Faster Progress on Clean Energy Technologies. Narrative polling finding.
DFP_20260427_0021,Data for Progress,https://www.dataforprogress.org/blog/2026/4/27/voters-prefer-cooperating-over-competing-with-china-to-enable-faster-progress-on-clean-energy-technologies,2026-04-27,favorability,voters say they have a favorable view of India (41%) and Mexico (45%).,climate,,41.0,,,1213,online_panel,voters,,dfp;climate;favorability,Article: Voters Prefer Cooperating Over Competing With China to Enable Faster Progress on Clean Energy Technologies. Narrative polling finding.
DFP_20260427_0022,Data for Progress,https://www.dataforprogress.org/blog/2026/4/27/voters-prefer-cooperating-over-competing-with-china-to-enable-faster-progress-on-clean-energy-technologies,2026-04-27,agreement,"A plurality of voters (47%), including majorities of Democrats (58%), Independents (52%), and voters under 45 (55%), agree more with a statement saying, “We’ll make progress on clean energy technologies faster if the United States prioritizes cooperating with China on the development and manufacturing of these technologies,” while 39% say we’ll make faster progress if we prioritize competition.",climate,,47.0,,,1213,online_panel,voters,,dfp;climate;agreement,Article: Voters Prefer Cooperating Over Competing With China to Enable Faster Progress on Clean Energy Technologies. Narrative polling finding.
DFP_20260427_0023,Data for Progress,https://www.dataforprogress.org/blog/2026/4/27/voters-prefer-cooperating-over-competing-with-china-to-enable-faster-progress-on-clean-energy-technologies,2026-04-27,polling_finding,"or China is the global leader in developing clean energy technologies, a slim majority of Americans (52%) choose the U.S over China (31%).",climate,,52.0,,,1213,online_panel,voters,,dfp;climate;polling_finding,Article: Voters Prefer Cooperating Over Competing With China to Enable Faster Progress on Clean Energy Technologies. Narrative polling finding.
DFP_20260427_0024,Data for Progress,https://www.dataforprogress.org/blog/2026/4/27/voters-prefer-cooperating-over-competing-with-china-to-enable-faster-progress-on-clean-energy-technologies,2026-04-27,likelihood,This includes 48% of voters who say they’re unlikely to buy an EV made in the U.S.,climate,,48.0,,,1213,online_panel,voters,,dfp;climate;likelihood,Article: Voters Prefer Cooperating Over Competing With China to Enable Faster Progress on Clean Energy Technologies. Narrative polling finding.
DFP_20260427_0025,Data for Progress,https://www.dataforprogress.org/blog/2026/4/27/voters-prefer-cooperating-over-competing-with-china-to-enable-faster-progress-on-clean-energy-technologies,2026-04-27,likelihood,"( N = 594), 56% who say they’re unlikely to buy an EV made elsewhere, and 60% who say they’re unlikely to buy a Chinese EV made in the U.S.",climate,,56.0,,,1213,online_panel,voters,,dfp;climate;likelihood,Article: Voters Prefer Cooperating Over Competing With China to Enable Faster Progress on Clean Energy Technologies. Narrative polling finding.
DFP_20260427_0026,Data for Progress,https://www.dataforprogress.org/blog/2026/4/27/voters-prefer-cooperating-over-competing-with-china-to-enable-faster-progress-on-clean-energy-technologies,2026-04-27,likelihood,"today ($56,000) and an expected price of Chinese EVs in Canada ($36,000), 41% of voters say they’re likely to buy an EV built in the U.S.",climate,,41.0,,,1213,online_panel,voters,,dfp;climate;likelihood,Article: Voters Prefer Cooperating Over Competing With China to Enable Faster Progress on Clean Energy Technologies. Narrative polling finding.
DFP_20260427_0027,Data for Progress,https://www.dataforprogress.org/blog/2026/4/27/voters-prefer-cooperating-over-competing-with-china-to-enable-faster-progress-on-clean-energy-technologies,2026-04-27,likelihood,"(N=594), and around 1 in 3 voters (34%) say they’re likely to buy a Chinese EV made in the U.S.",climate,,34.0,,,1213,online_panel,voters,,dfp;climate;likelihood,Article: Voters Prefer Cooperating Over Competing With China to Enable Faster Progress on Clean Energy Technologies. Narrative polling finding.
DFP_20260427_0028,Data for Progress,https://www.dataforprogress.org/blog/2026/4/27/voters-prefer-cooperating-over-competing-with-china-to-enable-faster-progress-on-clean-energy-technologies,2026-04-27,support_oppose_pair,"When asked if Americans should be able to purchase Chinese EVs in the U.S., voters are split, with a plurality (46%) saying they oppose making Chinese EVs available and 41% saying they support doing so.",climate,,46.0,,,1213,online_panel,voters,,dfp;climate;support_oppose_pair,Article: Voters Prefer Cooperating Over Competing With China to Enable Faster Progress on Clean Energy Technologies. Narrative polling finding.
DFP_20260422_0029,Data for Progress,https://www.dataforprogress.org/blog/2026/4/22/this-earth-day-two-thirds-of-voters-say-ensuring-clean-air-and-water-for-all-should-be-a-top-priority,2026-04-22,priority,"This Earth Day, Two-Thirds of Voters Say Ensuring Clean Air and Water for All Should Be a Top Priority On April 22, 1970, roughly 20 million Americans — 10% of the U.S.",other,,10.0,,,1085,online_panel,voters,,dfp;other;priority,"Article: This Earth Day, Two-Thirds of Voters Say Ensuring Clean Air and Water for All Should Be a Top Priority. Narrative polling finding."
DFP_20260422_0030,Data for Progress,https://www.dataforprogress.org/blog/2026/4/22/this-earth-day-two-thirds-of-voters-say-ensuring-clean-air-and-water-for-all-should-be-a-top-priority,2026-04-22,priority,"A strong, bipartisan majority of voters (66%) think ensuring every community has access to clean air and water should be a top priority for the U.S.",other,,66.0,,,1085,online_panel,voters,,dfp;other;priority,"Article: This Earth Day, Two-Thirds of Voters Say Ensuring Clean Air and Water for All Should Be a Top Priority. Narrative polling finding."
DFP_20260422_0031,Data for Progress,https://www.dataforprogress.org/blog/2026/4/22/this-earth-day-two-thirds-of-voters-say-ensuring-clean-air-and-water-for-all-should-be-a-top-priority,2026-04-22,trust,"A majority of voters (51%), including 60% of Independents, do not trust the Trump administration to ensure clean air and water for all Americans.",other,,51.0,,,1085,online_panel,voters,,dfp;other;trust,"Article: This Earth Day, Two-Thirds of Voters Say Ensuring Clean Air and Water for All Should Be a Top Priority. Narrative polling finding."
DFP_20260422_0032,Data for Progress,https://www.dataforprogress.org/blog/2026/4/22/this-earth-day-two-thirds-of-voters-say-ensuring-clean-air-and-water-for-all-should-be-a-top-priority,2026-04-22,disapproval,"This survey finds that a majority of voters (54%) disapprove of the way Trump is handling climate change and the environment, including 85% of Democrats and 58% of Independents.",climate,,54.0,,,1085,online_panel,voters,,dfp;climate;disapproval,"Article: This Earth Day, Two-Thirds of Voters Say Ensuring Clean Air and Water for All Should Be a Top Priority. Narrative polling finding."
DFP_20260422_0033,Data for Progress,https://www.dataforprogress.org/blog/2026/4/22/this-earth-day-two-thirds-of-voters-say-ensuring-clean-air-and-water-for-all-should-be-a-top-priority,2026-04-22,opinion,"is on the right or wrong track when it comes to addressing climate change, a majority (53%), including strong majorities of Democrats (75%) and Independents (63%), say the U.S.",climate,,53.0,,,1085,online_panel,voters,,dfp;climate;opinion,"Article: This Earth Day, Two-Thirds of Voters Say Ensuring Clean Air and Water for All Should Be a Top Priority. Narrative polling finding."
DFP_20260422_0034,Data for Progress,https://www.dataforprogress.org/blog/2026/4/22/this-earth-day-two-thirds-of-voters-say-ensuring-clean-air-and-water-for-all-should-be-a-top-priority,2026-04-22,polling_finding,"Respondents were next asked to choose between two statements related to the U.S.’s role in global climate leadership, with a bipartisan majority (68%) selecting the following statement: “The United States should take ambitious action to address climate change, even if other countries do not.",climate,,68.0,,,1085,online_panel,voters,,dfp;climate;polling_finding,"Article: This Earth Day, Two-Thirds of Voters Say Ensuring Clean Air and Water for All Should Be a Top Priority. Narrative polling finding."
DFP_20260422_0035,Data for Progress,https://www.dataforprogress.org/blog/2026/4/22/this-earth-day-two-thirds-of-voters-say-ensuring-clean-air-and-water-for-all-should-be-a-top-priority,2026-04-22,polling_finding,"We should lead the world on this issue and set the example for other countries to follow suit.” In contrast, just 25% of voters prefer the following statement: “If other countries do not take action to address climate change, the United States should not either.",climate,,25.0,,,1085,online_panel,voters,,dfp;climate;polling_finding,"Article: This Earth Day, Two-Thirds of Voters Say Ensuring Clean Air and Water for All Should Be a Top Priority. Narrative polling finding."
DFP_20260417_0036,Data for Progress,https://www.dataforprogress.org/blog/2026/4/17/voters-believe-legal-immigration-generally-helps-the-us,2026-04-17,opinion,"Half of voters (50%) say people are fleeing poverty and seeking economic opportunity, and 38% say people are fleeing violence, persecution, or war.",immigration,,50.0,,,1228,online_panel,voters,,dfp;immigration;opinion,Article: Voters Believe Legal Immigration Generally Helps the U.S.. Narrative polling finding.
DFP_20260417_0037,Data for Progress,https://www.dataforprogress.org/blog/2026/4/17/voters-believe-legal-immigration-generally-helps-the-us,2026-04-17,opinion,About one-third of voters (35%) believe people cross illegally because they want to take advantage of U.S.,immigration,,35.0,,,1228,online_panel,voters,,dfp;immigration;opinion,Article: Voters Believe Legal Immigration Generally Helps the U.S.. Narrative polling finding.
DFP_20260417_0038,Data for Progress,https://www.dataforprogress.org/blog/2026/4/17/voters-believe-legal-immigration-generally-helps-the-us,2026-04-17,polling_finding,"A majority of Republicans (56%) cite government services as a primary motivation, compared with just 14% of Democrats and 31% of Independents.",immigration,,14.0,,,1228,online_panel,voters,,dfp;immigration;polling_finding,Article: Voters Believe Legal Immigration Generally Helps the U.S.. Narrative polling finding.
DFP_20260417_0039,Data for Progress,https://www.dataforprogress.org/blog/2026/4/17/voters-believe-legal-immigration-generally-helps-the-us,2026-04-17,likelihood,"Democrats, meanwhile, are far more likely to cite humanitarian reasons: 53% say people are fleeing violence, compared with only 22% of Republicans.",immigration,,53.0,,,1228,online_panel,voters,,dfp;immigration;likelihood,Article: Voters Believe Legal Immigration Generally Helps the U.S.. Narrative polling finding.
DFP_20260417_0040,Data for Progress,https://www.dataforprogress.org/blog/2026/4/17/voters-believe-legal-immigration-generally-helps-the-us,2026-04-17,opinion,"Around two-thirds of voters (66%) say legal immigration generally helps the United States, compared with just 9% who say it generally hurts.",immigration,,66.0,,,1228,online_panel,voters,,dfp;immigration;opinion,Article: Voters Believe Legal Immigration Generally Helps the U.S.. Narrative polling finding.
DFP_20260417_0041,Data for Progress,https://www.dataforprogress.org/blog/2026/4/17/voters-believe-legal-immigration-generally-helps-the-us,2026-04-17,opinion,"This view holds across party lines: 71% of Democrats, 70% of Independents, and 59% of Republicans say legal immigration helps the country.",immigration,,71.0,,,1228,online_panel,voters,,dfp;immigration;opinion,Article: Voters Believe Legal Immigration Generally Helps the U.S.. Narrative polling finding.
DFP_20260417_0042,Data for Progress,https://www.dataforprogress.org/blog/2026/4/17/voters-believe-legal-immigration-generally-helps-the-us,2026-04-17,opinion,"A majority of voters (62%) say illegal immigration generally hurts the United States, while only 11% say it helps and 22% say it neither helps nor hurts.",immigration,,62.0,,,1228,online_panel,voters,,dfp;immigration;opinion,Article: Voters Believe Legal Immigration Generally Helps the U.S.. Narrative polling finding.
DFP_20260417_0043,Data for Progress,https://www.dataforprogress.org/blog/2026/4/17/voters-believe-legal-immigration-generally-helps-the-us,2026-04-17,concern,"Among the 62% of voters who say illegal immigration generally hurts the country, most are primarily concerned about the process by which people are immigrating, rather than the number of people crossing the border.",immigration,,62.0,,,1228,online_panel,voters,,dfp;immigration;concern,Article: Voters Believe Legal Immigration Generally Helps the U.S.. Narrative polling finding.
DFP_20260417_0044,Data for Progress,https://www.dataforprogress.org/blog/2026/4/17/voters-believe-legal-immigration-generally-helps-the-us,2026-04-17,concern,"A majority of these voters (57%) say their main concern is that they want a safer, more orderly process, while 41% say their main concern is that they want lower numbers of immigrants overall.",immigration,,57.0,,,1228,online_panel,voters,,dfp;immigration;concern,Article: Voters Believe Legal Immigration Generally Helps the U.S.. Narrative polling finding.
DFP_20260417_0045,Data for Progress,https://www.dataforprogress.org/blog/2026/4/17/voters-believe-legal-immigration-generally-helps-the-us,2026-04-17,polling_finding,"This split holds across partisan lines: 62% of Democrats, 60% of Independents, and 54% of Republicans who see illegal immigration as harmful prioritize the process over the numbers.",immigration,,62.0,,,1228,online_panel,voters,,dfp;immigration;polling_finding,Article: Voters Believe Legal Immigration Generally Helps the U.S.. Narrative polling finding.
DFP_20260417_0046,Data for Progress,https://www.dataforprogress.org/blog/2026/4/17/voters-believe-legal-immigration-generally-helps-the-us,2026-04-17,opinion,"When asked what effect increasing legal immigration would have on illegal immigration, half of voters (50%) say it would make no difference, and an additional 31% say it would cause illegal immigration to decrease.",immigration,,50.0,,,1228,online_panel,voters,,dfp;immigration;opinion,Article: Voters Believe Legal Immigration Generally Helps the U.S.. Narrative polling finding.
