poll_id,source,source_url,date,question_type,question_wording,topic,issue_area,support_pct,oppose_pct,net,sample_size,methodology,population,moe,tags,notes
DFP_20241008_0947,Data for Progress,https://www.dataforprogress.org/blog/2024/10/7/powering-the-future-voters-back-renewable-energy-investment-despite-divides-over-costs-and-grid-reliability,2024-10-08,support,"The results show broad support for renewable energy, with 65% of respondents favoring more investments in renewable energy, and an appetite for a federal renewable energy standard, with 62% in support.",climate,,65.0,,,1219,online_panel,voters,,dfp;climate;support,Article: Powering the Future: Voters Back Renewable Energy Investment Despite Divides Over Costs and Grid Reliability. Narrative polling finding.
DFP_20241008_0948,Data for Progress,https://www.dataforprogress.org/blog/2024/10/7/powering-the-future-voters-back-renewable-energy-investment-despite-divides-over-costs-and-grid-reliability,2024-10-08,support,"Support for investing in renewable energy is particularly strong among Democrats (83%) and voters under 45 (72%), though a majority of Independents (63%) and a plurality of Republicans (46%) also favor increasing renewable energy investments.",climate,,72.0,,,1219,online_panel,voters,,dfp;climate;support,Article: Powering the Future: Voters Back Renewable Energy Investment Despite Divides Over Costs and Grid Reliability. Narrative polling finding.
DFP_20241008_0949,Data for Progress,https://www.dataforprogress.org/blog/2024/10/7/powering-the-future-voters-back-renewable-energy-investment-despite-divides-over-costs-and-grid-reliability,2024-10-08,support,Black (75%) and Latino (69%) voters show stronger support for investing more in renewables than voters overall.,climate,,75.0,,,1219,online_panel,voters,,dfp;climate;support,Article: Powering the Future: Voters Back Renewable Energy Investment Despite Divides Over Costs and Grid Reliability. Narrative polling finding.
DFP_20241008_0950,Data for Progress,https://www.dataforprogress.org/blog/2024/10/7/powering-the-future-voters-back-renewable-energy-investment-despite-divides-over-costs-and-grid-reliability,2024-10-08,favorability,"Asked about their preferences around investment in fossil fuels, a plurality of voters (44%) favor more investment.",climate,,44.0,,,1219,online_panel,voters,,dfp;climate;favorability,Article: Powering the Future: Voters Back Renewable Energy Investment Despite Divides Over Costs and Grid Reliability. Narrative polling finding.
DFP_20241008_0951,Data for Progress,https://www.dataforprogress.org/blog/2024/10/7/powering-the-future-voters-back-renewable-energy-investment-despite-divides-over-costs-and-grid-reliability,2024-10-08,opinion,"should maintain current levels of investment in fossil fuels, while 30% think that U.S.",climate,,30.0,,,1219,online_panel,voters,,dfp;climate;opinion,Article: Powering the Future: Voters Back Renewable Energy Investment Despite Divides Over Costs and Grid Reliability. Narrative polling finding.
DFP_20241008_0952,Data for Progress,https://www.dataforprogress.org/blog/2024/10/7/powering-the-future-voters-back-renewable-energy-investment-despite-divides-over-costs-and-grid-reliability,2024-10-08,polling_finding,Voters were then asked about their attitudes toward a proposed federal renewable electricity standard that would require 20% of U.S.,climate,,20.0,,,1219,online_panel,voters,,dfp;climate;polling_finding,Article: Powering the Future: Voters Back Renewable Energy Investment Despite Divides Over Costs and Grid Reliability. Narrative polling finding.
DFP_20241008_0953,Data for Progress,https://www.dataforprogress.org/blog/2024/10/7/powering-the-future-voters-back-renewable-energy-investment-despite-divides-over-costs-and-grid-reliability,2024-10-08,support,"A majority (62%) of voters support this policy, with only 28% in opposition.",climate,,62.0,,,1219,online_panel,voters,,dfp;climate;support,Article: Powering the Future: Voters Back Renewable Energy Investment Despite Divides Over Costs and Grid Reliability. Narrative polling finding.
DFP_20241008_0954,Data for Progress,https://www.dataforprogress.org/blog/2024/10/7/powering-the-future-voters-back-renewable-energy-investment-despite-divides-over-costs-and-grid-reliability,2024-10-08,support,More Black (68%) and Latino (72%) voters are in support than white voters (59%).,climate,,68.0,,,1219,online_panel,voters,,dfp;climate;support,Article: Powering the Future: Voters Back Renewable Energy Investment Despite Divides Over Costs and Grid Reliability. Narrative polling finding.
DFP_20241008_0955,Data for Progress,https://www.dataforprogress.org/blog/2024/10/7/powering-the-future-voters-back-renewable-energy-investment-despite-divides-over-costs-and-grid-reliability,2024-10-08,opinion,"When asked how they think transitioning to renewable energy would impact electricity prices, a plurality of voters (41%) believe it would make electricity cheaper, while 36% expect it would increase rates, and 12% believe it would have no impact.",economy,,41.0,,,1219,online_panel,voters,,dfp;economy;opinion,Article: Powering the Future: Voters Back Renewable Energy Investment Despite Divides Over Costs and Grid Reliability. Narrative polling finding.
DFP_20241008_0956,Data for Progress,https://www.dataforprogress.org/blog/2024/10/7/powering-the-future-voters-back-renewable-energy-investment-despite-divides-over-costs-and-grid-reliability,2024-10-08,opinion,"While 41% of voters believe such a law would improve grid reliability and reduce the number of blackouts and outages, 31% think it would make the grid less reliable, and 16% think there would be no impact to grid reliability at all.",climate,,41.0,,,1219,online_panel,voters,,dfp;climate;opinion,Article: Powering the Future: Voters Back Renewable Energy Investment Despite Divides Over Costs and Grid Reliability. Narrative polling finding.
DFP_20241008_0957,Data for Progress,https://www.dataforprogress.org/blog/2024/10/7/powering-the-future-voters-back-renewable-energy-investment-despite-divides-over-costs-and-grid-reliability,2024-10-08,polling_finding,"There are significant differences across partisanship, with 54% of Democrats, 35% of Independents, and 32% of Republicans believing the policy would improve reliability.",climate,,54.0,,,1219,online_panel,voters,,dfp;climate;polling_finding,Article: Powering the Future: Voters Back Renewable Energy Investment Despite Divides Over Costs and Grid Reliability. Narrative polling finding.
DFP_20241008_0958,Data for Progress,https://www.dataforprogress.org/blog/2024/10/7/powering-the-future-voters-back-renewable-energy-investment-despite-divides-over-costs-and-grid-reliability,2024-10-08,polling_finding,"As with expected impacts to costs, Republicans are more pessimistic than topline voters, with a plurality (44%) believing that renewables would decrease reliability.",climate,,44.0,,,1219,online_panel,voters,,dfp;climate;polling_finding,Article: Powering the Future: Voters Back Renewable Energy Investment Despite Divides Over Costs and Grid Reliability. Narrative polling finding.
DFP_20241007_0959,Data for Progress,https://www.dataforprogress.org/blog/2024/10/7/measuring-the-current-77-of-voters-agree-more-transmission-is-important,2024-10-07,agreement,"Measuring the Current: 77% of Voters Agree More Transmission Is Important By Eva Brungard To unlock the renewable energy potential of the Inflation Reduction Act, the build-out of transmission infrastructure is key.",economy,,77.0,,,1202,online_panel,voters,,dfp;economy;agreement,Article: Measuring the Current: 77% of Voters Agree More Transmission Is Important. Narrative polling finding.
DFP_20241007_0960,Data for Progress,https://www.dataforprogress.org/blog/2024/10/7/measuring-the-current-77-of-voters-agree-more-transmission-is-important,2024-10-07,priority,"An overwhelming, bipartisan majority of voters (77%) believe that building more transmission is important for the U.S.",housing,,77.0,,,1202,online_panel,voters,,dfp;housing;priority,Article: Measuring the Current: 77% of Voters Agree More Transmission Is Important. Narrative polling finding.
DFP_20241007_0961,Data for Progress,https://www.dataforprogress.org/blog/2024/10/7/measuring-the-current-77-of-voters-agree-more-transmission-is-important,2024-10-07,favorability,"When asked about overhead transmission lines being built in their community, more than a third of respondents (34%) have not heard enough to say, with the remainder of respondents split between a favorable opinion (30%) and an unfavorable opinion (36%).",housing,,34.0,,,1202,online_panel,voters,,dfp;housing;favorability,Article: Measuring the Current: 77% of Voters Agree More Transmission Is Important. Narrative polling finding.
DFP_20241007_0962,Data for Progress,https://www.dataforprogress.org/blog/2024/10/7/measuring-the-current-77-of-voters-agree-more-transmission-is-important,2024-10-07,favorability,"Unsurprisingly, underground lines are more favorable (52%) despite being cost prohibitive for developers to date, though 34% of voters still haven’t heard enough to say their opinions.",housing,,52.0,,,1202,online_panel,voters,,dfp;housing;favorability,Article: Measuring the Current: 77% of Voters Agree More Transmission Is Important. Narrative polling finding.
DFP_20241007_0963,Data for Progress,https://www.dataforprogress.org/blog/2024/10/7/measuring-the-current-77-of-voters-agree-more-transmission-is-important,2024-10-07,favorability,"As a whole, underground infrastructure projects are perceived more favorably by voters than those which have a visible footprint, with the exception of solar panel farms (63% favorable).",housing,,63.0,,,1202,online_panel,voters,,dfp;housing;favorability,Article: Measuring the Current: 77% of Voters Agree More Transmission Is Important. Narrative polling finding.
DFP_20241007_0964,Data for Progress,https://www.dataforprogress.org/blog/2024/10/7/measuring-the-current-77-of-voters-agree-more-transmission-is-important,2024-10-07,polling_finding,"In general, the vast majority of American voters (90%) have heard little to nothing at all about transmission lines.",housing,,90.0,,,1202,online_panel,voters,,dfp;housing;polling_finding,Article: Measuring the Current: 77% of Voters Agree More Transmission Is Important. Narrative polling finding.
DFP_20241007_0965,Data for Progress,https://www.dataforprogress.org/blog/2024/10/7/measuring-the-current-77-of-voters-agree-more-transmission-is-important,2024-10-07,support,"Indeed, after reading a description of transmission lines that included information about their role in the electric power system and noted that these lines are typically placed overhead, 55% of voters say they would support a transmission line being built in their community.",housing,,55.0,,,1202,online_panel,voters,,dfp;housing;support,Article: Measuring the Current: 77% of Voters Agree More Transmission Is Important. Narrative polling finding.
DFP_20241007_0966,Data for Progress,https://www.dataforprogress.org/blog/2024/10/7/measuring-the-current-77-of-voters-agree-more-transmission-is-important,2024-10-07,support,"Support is slightly lower among Black (49%) voters, compared with white (57%) and Latino (66%) voters.",housing,,49.0,,,1202,online_panel,voters,,dfp;housing;support,Article: Measuring the Current: 77% of Voters Agree More Transmission Is Important. Narrative polling finding.
DFP_20241007_0967,Data for Progress,https://www.dataforprogress.org/blog/2024/10/7/measuring-the-current-77-of-voters-agree-more-transmission-is-important,2024-10-07,agreement,"A majority of respondents (60%) agree that new transmission would improve reliability, leading to fewer blackouts and outages.",housing,,60.0,,,1202,online_panel,voters,,dfp;housing;agreement,Article: Measuring the Current: 77% of Voters Agree More Transmission Is Important. Narrative polling finding.
DFP_20241007_0968,Data for Progress,https://www.dataforprogress.org/blog/2024/10/7/measuring-the-current-77-of-voters-agree-more-transmission-is-important,2024-10-07,opinion,"When asked about the impact of transmission build-out on their electricity bills, a plurality of voters (41%) believe that transmission projects would increase rates, compared with 23% who expect they would decrease rates.",housing,,41.0,,,1202,online_panel,voters,,dfp;housing;opinion,Article: Measuring the Current: 77% of Voters Agree More Transmission Is Important. Narrative polling finding.
DFP_20241007_0969,Data for Progress,https://www.dataforprogress.org/blog/2024/10/7/measuring-the-current-77-of-voters-agree-more-transmission-is-important,2024-10-07,support,"Most voters (58%) prefer a publicly owned and operated transmission system, compared with just 24% who support private ownership.",housing,,58.0,,,1202,online_panel,voters,,dfp;housing;support,Article: Measuring the Current: 77% of Voters Agree More Transmission Is Important. Narrative polling finding.
DFP_20241007_0970,Data for Progress,https://www.dataforprogress.org/blog/2024/10/7/measuring-the-current-77-of-voters-agree-more-transmission-is-important,2024-10-07,polling_finding,"Voters most want landowners to be compensated by recurring lease payments for the land (33%), followed by recurring royalty payments based on the revenue generated by the transmission lines (27%).",housing,,33.0,,,1202,online_panel,voters,,dfp;housing;polling_finding,Article: Measuring the Current: 77% of Voters Agree More Transmission Is Important. Narrative polling finding.
DFP_20241007_0971,Data for Progress,https://www.dataforprogress.org/blog/2024/10/7/measuring-the-current-77-of-voters-agree-more-transmission-is-important,2024-10-07,support,"Just 15% of voters support a one-time, lump sum payment for landowners, suggesting that, overall, voters want to see ongoing compensation for the impacts that landowners bear due to transmission projects.",housing,,15.0,,,1202,online_panel,voters,,dfp;housing;support,Article: Measuring the Current: 77% of Voters Agree More Transmission Is Important. Narrative polling finding.
DFP_20241007_0972,Data for Progress,https://www.dataforprogress.org/blog/2024/10/7/measuring-the-current-77-of-voters-agree-more-transmission-is-important,2024-10-07,polling_finding,"Voters most want a new transmission line to lower their energy bills (56%), followed by making the grid more reliable (50%) and enabling clean energy (43%).",climate,,56.0,,,1202,online_panel,voters,,dfp;climate;polling_finding,Article: Measuring the Current: 77% of Voters Agree More Transmission Is Important. Narrative polling finding.
DFP_20241007_0973,Data for Progress,https://www.dataforprogress.org/blog/2024/10/7/measuring-the-current-77-of-voters-agree-more-transmission-is-important,2024-10-07,support,Very few respondents cite the need for a new transmission line not to ruin their view (15%) or take up a small amount of land (16%) as important for securing their support.,housing,,15.0,,,1202,online_panel,voters,,dfp;housing;support,Article: Measuring the Current: 77% of Voters Agree More Transmission Is Important. Narrative polling finding.
DFP_20240927_0974,Data for Progress,https://www.dataforprogress.org/blog/2024/9/27/nyc-voters-distrust-mayor-eric-adams,2024-09-27,disapproval,Two-thirds of NYC voters (67%) disapprove of how Adams handles his duties as mayor.,other,,67.0,,,,online_panel,voters,,dfp;other;disapproval,Article: NYC Voters Distrust Mayor Eric Adams and Think He Prioritizes His Own Interests Over Everyday New Yorkers. Narrative polling finding.
DFP_20240927_0975,Data for Progress,https://www.dataforprogress.org/blog/2024/9/27/nyc-voters-distrust-mayor-eric-adams,2024-09-27,polling_finding,"This includes majorities of Democrats (61%) and voters of color who are Asian (73%), Latino (61%), and Black (55%).",other,,73.0,,,,online_panel,voters,,dfp;other;polling_finding,Article: NYC Voters Distrust Mayor Eric Adams and Think He Prioritizes His Own Interests Over Everyday New Yorkers. Narrative polling finding.
DFP_20240927_0976,Data for Progress,https://www.dataforprogress.org/blog/2024/9/27/nyc-voters-distrust-mayor-eric-adams,2024-09-27,favorability,"Similarly, when voters are asked if they have a favorable or unfavorable opinion of Adams and several NYC agencies, 62% of voters say they view Adams unfavorably, including a majority of Democrats (57%) and a plurality of Black voters (49%).",other,,62.0,,,,online_panel,voters,,dfp;other;favorability,Article: NYC Voters Distrust Mayor Eric Adams and Think He Prioritizes His Own Interests Over Everyday New Yorkers. Narrative polling finding.
DFP_20240927_0977,Data for Progress,https://www.dataforprogress.org/blog/2024/9/27/nyc-voters-distrust-mayor-eric-adams,2024-09-27,favorability,Only 26% of NYC voters view Adams favorably.,other,,26.0,,,,online_panel,voters,,dfp;other;favorability,Article: NYC Voters Distrust Mayor Eric Adams and Think He Prioritizes His Own Interests Over Everyday New Yorkers. Narrative polling finding.
DFP_20240927_0978,Data for Progress,https://www.dataforprogress.org/blog/2024/9/27/nyc-voters-distrust-mayor-eric-adams,2024-09-27,trust,"The highest trust rating Adams gets is from 30% of voters who think he will ensure the views of different NYC communities are reflected in policy, but 63% of voters still distrust him to do this.",housing,,30.0,,,,online_panel,voters,,dfp;housing;trust,Article: NYC Voters Distrust Mayor Eric Adams and Think He Prioritizes His Own Interests Over Everyday New Yorkers. Narrative polling finding.
DFP_20240927_0979,Data for Progress,https://www.dataforprogress.org/blog/2024/9/27/nyc-voters-distrust-mayor-eric-adams,2024-09-27,opinion,Nearly 2 in 3 voters (65%) say they have heard “nothing at all” about the five ballot measures or the Charter Revision Commission.,other,,65.0,,,,online_panel,voters,,dfp;other;opinion,Article: NYC Voters Distrust Mayor Eric Adams and Think He Prioritizes His Own Interests Over Everyday New Yorkers. Narrative polling finding.
DFP_20240927_0980,Data for Progress,https://www.dataforprogress.org/blog/2024/9/26/voters-want-to-make-it-easier-to-receive-social-security-disability-benefits,2024-09-27,opinion,A plurality of voters (49%) think the U.S.,other,,49.0,,,,online_panel,voters,,dfp;other;opinion,Article: Voters Want to Make It Easier to Receive Social Security Disability Benefits. Narrative polling finding.
DFP_20240927_0981,Data for Progress,https://www.dataforprogress.org/blog/2024/9/26/voters-want-to-make-it-easier-to-receive-social-security-disability-benefits,2024-09-27,opinion,"should take action to make it easier to receive benefits, while only 9% think the U.S.",other,,9.0,,,,online_panel,voters,,dfp;other;opinion,Article: Voters Want to Make It Easier to Receive Social Security Disability Benefits. Narrative polling finding.
DFP_20240927_0982,Data for Progress,https://www.dataforprogress.org/blog/2024/9/26/voters-want-to-make-it-easier-to-receive-social-security-disability-benefits,2024-09-27,opinion,"A majority of voters (56%) — including 65% of Democrats, 51% of Independents, 49% of Republicans, and 72% of disabled voters — think the U.S.",other,,56.0,,,,online_panel,voters,,dfp;other;opinion,Article: Voters Want to Make It Easier to Receive Social Security Disability Benefits. Narrative polling finding.
DFP_20240927_0983,Data for Progress,https://www.dataforprogress.org/blog/2024/9/26/voters-want-to-make-it-easier-to-receive-social-security-disability-benefits,2024-09-27,opinion,"Less than 10% of Democrats, Independents, and Republicans believe we should cut SSI funding.",other,,10.0,,,,online_panel,voters,,dfp;other;opinion,Article: Voters Want to Make It Easier to Receive Social Security Disability Benefits. Narrative polling finding.
DFP_20240927_0984,Data for Progress,https://www.dataforprogress.org/blog/2024/9/26/voters-want-to-make-it-easier-to-receive-social-security-disability-benefits,2024-09-27,support,"The survey finds an overwhelming majority of voters (72%), including 80% of Democrats, 68% of Independents, 67% of Republicans, and 75% of disabled voters, support raising this asset cap to $10,000 for individuals and $20,000 for married couples.",other,,72.0,,,,online_panel,voters,,dfp;other;support,Article: Voters Want to Make It Easier to Receive Social Security Disability Benefits. Narrative polling finding.
DFP_20240927_0985,Data for Progress,https://www.dataforprogress.org/blog/2024/9/26/voters-want-to-make-it-easier-to-receive-social-security-disability-benefits,2024-09-27,polling_finding,"This includes 79% of Democrats, 69% of Independents, 68% of Republicans, and 76% of disabled voters.",other,,79.0,,,,online_panel,voters,,dfp;other;polling_finding,Article: Voters Want to Make It Easier to Receive Social Security Disability Benefits. Narrative polling finding.
DFP_20240927_0986,Data for Progress,https://www.dataforprogress.org/blog/2024/9/26/voters-want-to-make-it-easier-to-receive-social-security-disability-benefits,2024-09-27,support,An overwhelming majority of voters (76%) support tying these caps to inflation.,economy,,76.0,,,,online_panel,voters,,dfp;economy;support,Article: Voters Want to Make It Easier to Receive Social Security Disability Benefits. Narrative polling finding.
DFP_20240927_0987,Data for Progress,https://www.dataforprogress.org/blog/2024/9/26/voters-want-to-make-it-easier-to-receive-social-security-disability-benefits,2024-09-27,polling_finding,"A majority of voters across party lines — including 58% of Democrats, 63% of Independents, 55% of Republicans, and 66% of disabled voters — want the U.S.",other,,58.0,,,,online_panel,voters,,dfp;other;polling_finding,Article: Voters Want to Make It Easier to Receive Social Security Disability Benefits. Narrative polling finding.
DFP_20240927_0988,Data for Progress,https://www.dataforprogress.org/blog/2024/9/26/voters-want-to-make-it-easier-to-receive-social-security-disability-benefits,2024-09-27,trust,"Sixty percent of voters think the Social Security Administration (SSA) should trust the individual’s personal medical professional most, while only 32% think the SSA should trust an outside medical professional that the individual is sent to.",healthcare,,32.0,,,,online_panel,voters,,dfp;healthcare;trust,Article: Voters Want to Make It Easier to Receive Social Security Disability Benefits. Narrative polling finding.
DFP_20240927_0989,Data for Progress,https://www.dataforprogress.org/blog/2024/9/26/voters-want-to-make-it-easier-to-receive-social-security-disability-benefits,2024-09-27,support,"Three-quarters of voters (75%) support this requirement, while only 17% believe this shouldn’t be required.",other,,75.0,,,,online_panel,voters,,dfp;other;support,Article: Voters Want to Make It Easier to Receive Social Security Disability Benefits. Narrative polling finding.
DFP_20240926_0990,Data for Progress,https://www.dataforprogress.org/blog/2024/9/26/voters-strongly-support-the-polluters-pay-climate-fund-act,2024-09-26,support,"Consistent with results from a December 2023 poll fielded in conjunction with Fossil Free Media, we find that two-thirds of likely voters support a bill to make polluters pay to confront the climate crisis, including half of Republican voters (50%).",climate,,50.0,,,,online_panel,voters,,dfp;climate;support,Article: Voters Strongly Support the Polluters Pay Climate Fund Act. Narrative polling finding.
DFP_20240926_0991,Data for Progress,https://www.dataforprogress.org/blog/2024/9/26/voters-strongly-support-the-polluters-pay-climate-fund-act,2024-09-26,support,Black (71%) and Latino (79%) voters show stronger support than voters overall.,climate,,71.0,,,,online_panel,voters,,dfp;climate;support,Article: Voters Strongly Support the Polluters Pay Climate Fund Act. Narrative polling finding.
DFP_20240926_0992,Data for Progress,https://www.dataforprogress.org/blog/2024/9/26/voters-strongly-support-the-polluters-pay-climate-fund-act,2024-09-26,opinion,"Other questions in the survey reveal that, compared with previous research, similar numbers of voters believe that climate change is mostly the result of human activity rather than natural changes in the climate cycle (60%).",climate,,60.0,,,,online_panel,voters,,dfp;climate;opinion,Article: Voters Strongly Support the Polluters Pay Climate Fund Act. Narrative polling finding.
DFP_20240926_0993,Data for Progress,https://www.dataforprogress.org/blog/2024/9/26/voters-strongly-support-the-polluters-pay-climate-fund-act,2024-09-26,opinion,"In addition, a plurality of voters (48%) believe that private corporations have the most responsibility for causing or accelerating climate change in the U.S.",climate,,48.0,,,,online_panel,voters,,dfp;climate;opinion,Article: Voters Strongly Support the Polluters Pay Climate Fund Act. Narrative polling finding.
DFP_20240926_0994,Data for Progress,https://www.dataforprogress.org/blog/2024/9/26/voters-strongly-support-the-polluters-pay-climate-fund-act,2024-09-26,opinion,"Voters as a whole are divided on who should pay the majority of the costs associated with addressing climate change: 33% say private companies should pay for a majority of the costs, while 32% say no group in particular should be primarily responsible.",climate,,33.0,,,,online_panel,voters,,dfp;climate;opinion,Article: Voters Strongly Support the Polluters Pay Climate Fund Act. Narrative polling finding.
DFP_20240926_0995,Data for Progress,https://www.dataforprogress.org/blog/2024/9/26/voters-strongly-support-the-polluters-pay-climate-fund-act,2024-09-26,opinion,"However, sentiment is stronger among younger voters, as 37% of respondents under 45 think that private companies should be most responsible for bearing the financial burden of climate change.",climate,,37.0,,,,online_panel,voters,,dfp;climate;opinion,Article: Voters Strongly Support the Polluters Pay Climate Fund Act. Narrative polling finding.
