date,title,url,is_polling
"Thu, 01 Se",Voters Affirm the Senate’s Mandate to Fill Judicial Vacancies Ahead of the Midterm Elections,https://www.dataforprogress.org/blog/2022/9/1/voters-affirm-the-senates-mandate-to-fill-judicial-vacancies,True
"Thu, 01 Se",The Biden Administration’s Student Debt Relief Plan Is Popular and Will Benefit the Economy,https://www.dataforprogress.org/blog/2022/9/1/the-biden-administrations-student-debt-relief-plan-is-popular-and-will-benefit-the-economy,False
"Thu, 01 Se",Wisconsin Voters Support the Inflation Reduction Act and Bold Actions to Address Climate Change,https://www.dataforprogress.org/blog/2022/9/1/wisconsin-voters-support-the-inflation-reduction-act-and-bold-actions-to-address-climate-change,True
"Tue, 30 Au",Michigan Voters Support the Inflation Reduction Act and Bold Actions to Address Climate Change,https://www.dataforprogress.org/blog/2022/8/30/michigan-voters-support-the-inflation-reduction-act-and-bold-actions-to-address-climate-change,True
"Fri, 26 Au",Dear Dems: Please Just Run Against Mitch,https://www.dataforprogress.org/blog/2022/8/26/dear-dems-please-just-run-against-mitch,False
"Thu, 25 Au",Gas Rules Everything Around Me,https://www.dataforprogress.org/blog/2022/8/25/gas-rules-everything-around-me,False
"Wed, 24 Au",A Majority of Voters Support Canceling Student Debt  ,https://www.dataforprogress.org/blog/2022/8/24/a-majority-of-voters-support-canceling-student-debt,True
"Tue, 23 Au",Voters Support Investments In Broadband Services,https://www.dataforprogress.org/blog/2022/8/23/voters-support-investments-in-broadband-services,True
"Mon, 22 Au",A Majority of Voters Support Federal Protection of Same-Sex Marriage,https://www.dataforprogress.org/blog/2022/8/22/a-majority-of-voters-support-federal-protection-of-same-sex-marriage,True
"Thu, 18 Au",Preventing Semiconductor Corporate Greed Is Popular with Voters,https://www.dataforprogress.org/blog/2022/8/18/preventing-semiconductor-corporate-greed-is-popular-with-voters,True
"Thu, 18 Au",Death to Pennies: A Majority of Voters Support Stopping the Production of New Pennies ,https://www.dataforprogress.org/blog/2022/8/18/death-to-pennies,True
"Mon, 15 Au","On the 87th Anniversary of Social Security, Voters Fear Republican Cuts and Want Democrats to Expand Benefits",https://www.dataforprogress.org/blog/2022/8/15/on-the-87th-anniversary-of-social-security-voters-fear-republican-cuts-and-want-democrats-to-expand-benefits,True
"Fri, 12 Au",A Bipartisan Majority of Americans Support Raising the Minimum Congressional Staff Salary,https://www.dataforprogress.org/blog/2022/8/11/a-bipartisan-majority-of-americans-support-raising-the-minimum-congressional-staff-salary,True
"Thu, 11 Au",Voters Are Concerned About the Increasing Cost of Housing and Want Government Action ,https://www.dataforprogress.org/blog/2022/8/11/voters-are-concerned-about-the-increasing-cost-of-housing-and-want-government-action,True
"Thu, 11 Au",A Progressive Case for the Inflation Reduction Act,https://www.dataforprogress.org/blog/2022/8/11/a-progressive-case-for-the-inflation-reduction-act,False
"Wed, 10 Au",A Majority of Arizonans Support The Inflation Reduction Act,https://www.dataforprogress.org/blog/2022/8/10/a-majority-of-arizonans-support-the-inflation-reduction-act,True
"Mon, 08 Au",Voters Overwhelmingly Support Expanding Consumer Financial Protections,https://www.dataforprogress.org/blog/2022/8/2/voters-overwhelmingly-support-expanding-consumer-financial-protections,True
"Mon, 08 Au",Voters Want Increased Gun Safety and Community Violence Intervention,https://www.dataforprogress.org/blog/2022/8/8/voters-want-increased-gun-safety-and-community-violence-intervention,True
"Thu, 04 Au",Voters Support the Inflation Reduction Act’s Investments in American Families,https://www.dataforprogress.org/blog/2022/8/4/voters-support-the-inflation-reduction-acts-investments-in-american-families,True
"Thu, 04 Au",Young Voters Are More Likely to Prioritize Abortion Rights in Upcoming Midterms,https://www.dataforprogress.org/blog/2022/8/4/young-voters-are-more-likely-to-prioritize-abortion-rights-in-upcoming-midterms,True
"Wed, 03 Au","Voters Favor Diplomacy, Not War, When It Comes to Stopping Iran’s Nuclear Program ",https://www.dataforprogress.org/blog/2022/8/3/voters-favor-diplomacy-not-war-when-it-comes-to-stopping-irans-nuclear-program,True
"Wed, 03 Au",Voters Support the Inflation Reduction Act,https://www.dataforprogress.org/blog/2022/8/3/voters-support-the-inflation-reduction-act,True
"Wed, 03 Au",Voters Demand Farm Animal Protections From Both Politicians and Companies ,https://www.dataforprogress.org/blog/2022/8/2/voters-demand-farm-animal-protections-from-both-politicians-and-companies,True
"Tue, 02 Au",Voters Want Companies to Improve Transparency Around Their Climate Emissions,https://www.dataforprogress.org/blog/2022/8/2/voters-want-companies-to-improve-transparency-around-their-climate-emissions,True
"Mon, 01 Au",Becca Balint Leads Molly Gray by +32-Point Margin in Vermont’s At-Large Congressional Democratic Primary ,https://www.dataforprogress.org/blog/2022/7/29/becca-balint-leads-molly-gray-by-32-point-margin-in-vermonts-at-large-congressional-democratic-primary,False
"Fri, 29 Ju",Voters Support Congress Increasing Funding for Healthcare Coverage and Agree With Messaging in Support of Healthcare for All   ,https://www.dataforprogress.org/blog/2022/7/29/voters-support-congress-increasing-funding-for-healthcare-coverage-and-agree-with-messaging-in-support-of-healthcare-for-all,True
"Thu, 28 Ju","To Win in November, Democrats Should Pass Medicare Reforms",https://www.dataforprogress.org/blog/2022/7/28/to-win-in-november-democrats-should-pass-medicare-reforms,False
"Wed, 27 Ju","The Economy Remains Key Issue for Midterm Voters, But Abortion Rights Have Risen in Importance Post-Dobbs",https://www.dataforprogress.org/blog/2022/7/27/the-economy-remains-key-issue-for-midterm-voters-but-abortion-rights-have-risen-in-importance-post-dobbs,True
"Fri, 22 Ju",Voters Support Capping Insulin Prices at $35 Per Month for All Americans,https://www.dataforprogress.org/blog/voters-support-capping-insulin-prices-at-35-per-month-for-all-americans,True
"Thu, 21 Ju",New Hampshire Voters Would Not Blame Elected Leaders for Losing First Primary Status,https://www.dataforprogress.org/blog/2022/7/12/new-hampshire-voters-would-not-blame-elected-leaders-for-losing-first-primary-status,True
"Fri, 15 Ju","New Poll Shows Blair, Elrich Tied in Race for Montgomery County Executive",https://www.dataforprogress.org/blog/new-poll-shows-blair-elrich-tied-in-race-for-montgomery-county-executive,True
"Fri, 15 Ju",A Majority of Voters Fear For Their Rights Post-Roe,https://www.dataforprogress.org/blog/2022/7/15/a-majority-of-voters-fear-for-their-rights-post-roe,True
"Thu, 14 Ju",Voters Agree: Fossil Fuel Funding in Climate Research Presents Conflict of Interest,https://www.dataforprogress.org/blog/2022/7/14/voters-agree-fossil-fuel-funding-in-climate-research-presents-conflict-of-interest,True
"Thu, 14 Ju","Senator Warren: Filing Taxes Should Be Free, Fast, and Easy",https://www.dataforprogress.org/blog/2022/7/13/senator-warren-filing-taxes-should-be-free-fast-and-easy,False
"Tue, 12 Ju",Voters Strongly Support the Bipartisan Honoring Our PACT Act,https://www.dataforprogress.org/blog/2022/7/12/voters-strongly-support-the-bipartisan-honoring-our-pact-act,True
"Tue, 12 Ju",Majority of American Voters Oppose Corporations Donating to Jan. 6 Election Overturners,https://www.dataforprogress.org/blog/2022/7/11/majority-of-american-voters-oppose-corporations-donating-to-jan-6-election-overturners,True
"Mon, 11 Ju",What Can Ballot Initiatives Defending Abortion Rights Tell Us About Public Opinion on Abortion?,https://www.dataforprogress.org/blog/2022/7/11/what-can-ballot-initiatives-defending-abortion-rights-tell-us-about-public-opinion-on-abortion,False
"Thu, 07 Ju",Young Voters Are More Concerned About the Tampon Shortage,https://www.dataforprogress.org/blog/2022/7/7/young-voters-are-more-concerned-about-the-tampon-shortage,True
"Wed, 06 Ju",Community Benefits Agreements Offer Meaningful Opportunities to Include Voters’ Voices in Development ,https://www.dataforprogress.org/blog/2022/7/5/community-benefits-agreements-offer-meaningful-opportunities-to-include-voters-voices-in-development,True
"Tue, 05 Ju",A Bipartisan Majority of New York Voters Support a Full Minimum Wage for Tipped Workers,https://www.dataforprogress.org/blog/2022/7/5/a-bipartisan-majority-of-new-york-voters-support-a-full-minimum-wage-for-tipped-workers,True
"Tue, 05 Ju",Voters Are Concerned About the Treatment of Pregnant People in the Workplace ,https://www.dataforprogress.org/blog/2022/7/5/voters-are-concerned-about-the-treatment-of-pregnant-people-in-the-workplace,True
"Fri, 01 Ju",Sen. Gillibrand: The Bipartisan Gun Safety Bill Is a Major Step Forward in Tackling Gun Violence,https://www.dataforprogress.org/blog/sen-gillibrand-the-bipartisan-gun-safety-bill-iis-a-major-step-forward-in-tackling-gun-violence,False
"Thu, 30 Ju",Vermont Voters Support Treating Drug Addiction as a Health Issue and Decriminalizing Simple Possession,https://www.dataforprogress.org/blog/2022/6/30/vermont-voters-support-treating-drug-addiction-as-a-health-issue-and-decriminalizing-simple-possession,True
"Wed, 29 Ju",Democrats Must Act on Prescription Drug Reform — And Voters Agree ,https://www.dataforprogress.org/blog/2022/6/29/democrats-must-act-on-prescription-drug-reform-and-voters-agree,True
"Wed, 29 Ju","The High Road on Wealth and Job Creation: Americans Want Less Smokestack Chasing,  More Local Entrepreneurial Ecosystem Support",https://www.dataforprogress.org/blog/2022/6/29/the-high-road-on-wealth-and-job-creation-americans-want-less-smokestack-chasing-more-local-entrepreneurial-ecosystem-support,True
"Tue, 28 Ju",A Majority of Voters Believe the Jan. 6 Attack Was an Attempt to Hold Power and Overturn the Will of the People,https://www.dataforprogress.org/blog/2022/6/28/a-majority-of-voters-believe-the-jan-6-attack-was-an-attempt-to-hold-power-and-overturn-the-will-of-the-people,True
"Tue, 28 Ju",Voters Reject the Supreme Court’s Decision to Overturn Roe v. Wade,https://www.dataforprogress.org/blog/2022/6/28/voters-reject-the-supreme-courts-decision-to-overturn-roe-v-wade,True
"Mon, 27 Ju",Washington Voters Want to Decriminalize Drug Possession and Fund Substance Abuse Resources,https://www.dataforprogress.org/blog/2022/6/27/washington-voters-want-to-pass-i-1922-and-decriminalize-drug-possession,True
"Thu, 23 Ju",Analyzing the Issues That Motivate Voters ,https://www.dataforprogress.org/blog/2022/6/23/analyzing-the-issues-that-motivate-voters,True
"Wed, 22 Ju","For the Recently Announced Senate Gun Bill, Bipartisan Action Means Bipartisan Support",https://www.dataforprogress.org/blog/2022/6/22/for-the-recently-announced-senate-gun-bill-bipartisan-action-means-bipartisan-support,True
"Wed, 22 Ju",Georgia Voters Want the State’s Department of Labor to Take Stronger Action to Protect Workers,https://www.dataforprogress.org/blog/2022/6/22/georgia-voters-want-the-states-department-of-labor-to-take-stronger-action-to-protect-workers,True
"Tue, 21 Ju",Voters Are Concerned About Upcoming SCOTUS Ruling on West Virginia v. EPA,https://www.dataforprogress.org/blog/2022/6/21/voters-are-concerned-about-upcoming-scotus-ruling-on-west-virginia-v-epa,True
"Thu, 16 Ju",Voters Support Stricter Gun Reform Policies,https://www.dataforprogress.org/blog/2022/6/16/voters-support-stricter-gun-reform-policies,True
"Thu, 16 Ju",Did Protests Harm Biden’s Performance?,https://www.dataforprogress.org/blog/2022/6/15/did-protests-harm-bidens-performance,False
"Tue, 14 Ju",Virginia Voters Demand a New Approach to Criminal Justice,https://www.dataforprogress.org/blog/2022/6/14/virginia-voters-demand-a-new-approach-to-criminal-justice,True
"Tue, 14 Ju",A Bipartisan Majority of Voters Are Concerned About the Impact Big Tech Companies Have on the U.S. Economy and on Economic Competition,https://www.dataforprogress.org/blog/2022/6/14/a-bipartisan-majority-of-voters-are-concerned-about-the-impact-big-tech-companies-have-on-the-us-economy-and-on-economic-competition,True
"Mon, 13 Ju","After the Uvalde Shooting, Majority of Voters Support Red Flag Laws and Stricter Gun Control ",https://www.dataforprogress.org/blog/2022/6/13/after-the-uvalde-shooting-majority-of-voters-support-red-flag-laws-and-stricter-gun-control,True
"Thu, 09 Ju",New Poll Finds That Opinions About Cancel Culture Stem From Media,https://www.dataforprogress.org/blog/2022/6/9/new-poll-finds-that-opinions-about-cancel-culture-stem-from-media,True
"Wed, 08 Ju",Voters Support Common-Sense Gun Control Laws That Have Proven Successful in Other Countries ,https://www.dataforprogress.org/blog/2022/6/8/voters-support-common-sense-gun-control-laws-that-have-proven-successful-in-other-countries,True
"Tue, 07 Ju",A Bipartisan Majority of Voters Support Expanding Access to Birth Control ,https://www.dataforprogress.org/blog/2022/6/7/a-bipartisan-majority-of-voters-support-expanding-access-to-birth-control,True
"Tue, 07 Ju",Americans Widely Reject Proposals for More Pentagon Spending — So Should Congress,https://www.dataforprogress.org/blog/2022/6/7/americans-widely-reject-proposals-for-more-pentagon-spending,False
"Mon, 06 Ju",Voters Support Student Unionization,https://www.dataforprogress.org/blog/2022/6/6/voters-support-student-unionization,True
"Fri, 03 Ju",Texas Voters Support Expanding Clean Energy Production and Strengthening Regulations on Oil and Gas Producers ,https://www.dataforprogress.org/blog/2022/6/3/texas-voters-support-expanding-clean-energy,True
"Thu, 02 Ju","Fifty Years Later, Voters Support Passing the Equal Rights Amendment",https://www.dataforprogress.org/blog/2022/6/2/fifty-years-later-voters-support-passing-the-equal-rights-amendment,True
"Fri, 27 Ma",Voters Are Concerned About the Baby Formula Shortage,https://www.dataforprogress.org/blog/2022/5/27/voters-are-concerned-about-the-baby-formula-shortage,True
"Thu, 26 Ma",Independent Voters Support Democratic Plans to Expand Social Security Benefits,https://www.dataforprogress.org/blog/2022/5/26/independent-voters-support-democratic-plans-to-expand-social-security-benefits,True
"Wed, 25 Ma",Voters Agree That Taxing the Rich Could Help Alleviate Inflation ,https://www.dataforprogress.org/blog/2022/5/24/voters-agree-that-taxing-the-rich-could-help-alleviate-inflation,True
"Tue, 24 Ma",Pennsylvania Voters Across Parties Support Public Investments for Housing Repairs,https://www.dataforprogress.org/blog/2022/5/23/pa-voters-support-public-investments-for-housing-repairs,True
"Mon, 23 Ma",Voters Increasingly View Abortion as a Top Priority,https://www.dataforprogress.org/blog/2022/5/18/voters-increasingly-view-abortion-as-a-top-priority,True
"Fri, 20 Ma",Two Tools to Solve Traffic Violence,https://www.dataforprogress.org/blog/2022/5/20/two-tools-to-solve-traffic-violence-new-york-city,False
"Wed, 18 Ma",Voters Want State and Federal Lawmakers to Lead on Carbon Dioxide Removal ,https://www.dataforprogress.org/blog/2022/5/18/voters-want-state-and-federal-lawmakers-to-lead-on-carbon-dioxide-removal-new-york,True
"Wed, 18 Ma",California Voters Demand Tech Regulations To Protect Children,https://www.dataforprogress.org/blog/2022/5/18/california-voters-demand-tech-regulations-to-protect-children,True
"Tue, 17 Ma","Voters Back Lowering Rx Prices, Medicare Dental, and Other Health Executive Orders",https://www.dataforprogress.org/blog/2022/5/16/voters-support-progressive-healthcare-proposals,True
"Mon, 16 Ma",New Yorkers Agree: It’s Time to End Legal Slavery in State Prisons ,https://www.dataforprogress.org/blog/2022/5/16/new-yorkers-agree-its-time-to-end-legal-slavery-in-state-prisons,False
"Thu, 12 Ma",Republicans Decline Cawthorn’s Invite for Re-election,https://www.dataforprogress.org/blog/2022/5/12/voters-including-republicans-decline-cawthorns-invite-for-re-election,False
"Thu, 12 Ma",Bipartisan Majority of Ohio Voters Support Harm Reduction and Bail Reform Measures ,https://www.dataforprogress.org/blog/2022/5/11/bipartisan-majority-of-ohio-voters-support-harm-reduction-and-bail-reform-measures,True
"Wed, 11 Ma",Voters Back the Schedules That Work Act,https://www.dataforprogress.org/blog/2022/5/11/voters-support-schedules-that-work-act,True
"Wed, 11 Ma",Transforming Young People’s Climate Concern into Climate Action,https://www.dataforprogress.org/blog/2022/5/11/transforming-young-peoples-climate-concern-into-climate-action,False
"Mon, 09 Ma",Voters Support UTI Investment and Research,https://www.dataforprogress.org/blog/2022/5/9/voters-support-uti-investment-and-research,True
"Fri, 06 Ma",New York Voters Overwhelmingly Support Legislation to Reduce Air Pollution and Asthma Rates,https://www.dataforprogress.org/blog/2022/5/6/new-york-voters-support-legislation-to-reduce-air-pollution-and-asthma-rates,True
"Thu, 05 Ma",Voters Strongly Believe the Supreme Court Should Uphold Roe v. Wade,https://www.dataforprogress.org/blog/2022/5/5/voters-uphold-roe,True
"Wed, 04 Ma","Now Is Our Last, Best Chance to Act on Climate, and Voters Want Congress to Take Action",https://www.dataforprogress.org/blog/voters-want-congress-to-take-action-climate,True
"Wed, 04 Ma",Voters Continue to Overwhelmingly Support President Biden’s Investment Package,https://www.dataforprogress.org/blog/2022/5/3/voters-coverwhelmingly-support-bidens-investment-package,True
"Thu, 28 Ap",New York Voters Want a Higher Minimum Wage,https://www.dataforprogress.org/blog/2022/4/28/ny-min-wage,True
"Mon, 25 Ap",Voters Support Senator Sanders’ Save American Baseball Act,https://www.dataforprogress.org/blog/2022/4/25/voters-across-party-lines-support-senator-sanders-save-american-baseball-act,True
"Fri, 22 Ap","This Earth Day, Biden Must Center Indigenous Voices to Live Up to Climate Promises",https://www.dataforprogress.org/blog/2022/4/22/this-earth-day-biden-must-center-indigenous-voices-to-live-up-to-climate-promises,False
"Fri, 22 Ap",Bipartisan Majority of Voters Support Harm Reduction Measures and Decriminalizing Small Amounts of Drug Possession,https://www.dataforprogress.org/blog/2022/4/20/bipartisan-majority-of-voters-support-harm-reduction-measures-and-decriminalizing,True
"Tue, 19 Ap","Voters Are Split on Their Perception of the Supreme Court, but Support a Code of Ethics for Justices",https://www.dataforprogress.org/blog/2022/4/19/voters-are-split-on-their-perception-of-the-supreme-court-but-support-a-code-of-ethics-for-justices,True
"Mon, 18 Ap",Tax the Wealthiest New Yorkers and Invest in Our New York,https://www.dataforprogress.org/blog/2022/4/18/tax-the-wealthiest-new-yorkers-and-invest-in-our-new-york,False
"Mon, 18 Ap",The Billionaire Minimum Income Tax Is Popular,https://www.dataforprogress.org/blog/2022/4/18/the-billionaire-minimum-income-tax-is-popular,False
"Thu, 14 Ap",Voters Support the Historic Confirmation of Judge Ketanji Brown Jackson,https://www.dataforprogress.org/blog/2022/4/14/voters-support-confirmation-of-judge-ketanji-brown-jackson,True
"Mon, 11 Ap",Voters Overwhelmingly Support Expanding Access to Pregnancy-Related Healthcare,https://www.dataforprogress.org/blog/2022/4/11/voters-overwhelmingly-support-expanding-access-to-pregnancy-related-healthcare,True
"Mon, 11 Ap",A Cuomo Statewide Run Could Jeopardize Democrats' Chances of Retaining the NY Governorship,https://www.dataforprogress.org/blog/2022/4/11/cuomo-jeopardize-dems,False
"Mon, 11 Ap",National Polling Shows Fur Is Out of Fashion,https://www.dataforprogress.org/blog/2022/4/11/national-polling-shows-fur-is-out-of-fashion,True
"Thu, 07 Ap",Student Debt Relief Will Lead to Higher Voter Turnout in Battleground States,https://www.dataforprogress.org/blog/2022/4/7/student-debt-relief-will-lead-to-higher-voter-turnout-in-battleground-states,True
"Wed, 06 Ap",Voters Nationwide Oppose a Missouri Bill That Would Punish Residents Seeking Abortions Out of the State,https://www.dataforprogress.org/blog/2022/4/6/voters-nationwide-oppose-a-missouri-bill-that-would-punish-residents-seeking-abortions-out-of-the-state,True
"Wed, 06 Ap",2022 Appropriations Pave the Way for Historic Climate and Energy Investments,https://www.dataforprogress.org/blog/2022/4/06/appropriations-pave-way-for-historic-climate-investments,False
"Mon, 04 Ap","Voters Support Ending Forced Arbitration of Sexual Assault, Harassment Cases",https://www.dataforprogress.org/blog/2022/4/4/voters-support-ending-forced-arbitration-of-sexual-assault-harassment-cases,True
"Thu, 31 Ma",Voters Support Using the Defense Production Act to Accelerate Clean Energy Production,https://www.dataforprogress.org/blog/2022/3/31/voters-support-using-the-defense-production-act-to-accelerate-clean-energy-production,True
"Wed, 30 Ma",A Bipartisan Majority of Voters Support the Postal Service Reform Act,https://www.dataforprogress.org/blog/2022/3/30/a-bipartisan-majority-of-voters-support-the-postal-service-reform-act,True
"Tue, 29 Ma",Voters Support the No Surprises Act,https://www.dataforprogress.org/blog/2022/3/29/voters-support-the-no-surprises-act,True
"Mon, 28 Ma",Young Voters Want Biden to Act on Climate and Fossil Fuel Industry Accountability ,https://www.dataforprogress.org/blog/2022/3/28/young-voters-want-biden-to-act-on-climate-and-fossil-fuel-industry-accountability,True
"Thu, 24 Ma",The Price of Insulin Is Too High. Voters Support Capping It.,https://www.dataforprogress.org/blog/2022/3/24/the-price-of-insulin-is-too-high-voters-support-capping-it,True
"Thu, 24 Ma",Voters Support Strong Labor Standards for IIJA Jobs,https://www.dataforprogress.org/blog/2022/3/24/voters-support-strong-labor-standards-for-iija-jobs,True
"Wed, 23 Ma",Voters Support Making Daylight Saving Time Permanent,https://www.dataforprogress.org/blog/2022/3/23/voters-support-making-daylight-saving-time-permanent,True
"Tue, 22 Ma",Voters Support Reauthorizing the Violence Against Women Act,https://www.dataforprogress.org/blog/2022/3/22/voters-support-reauthorizing-the-violence-against-women-act,True
"Fri, 18 Ma","Now More Than Ever, Voters Support Ramping Up Clean Energy Production in the U.S.",https://www.dataforprogress.org/blog/2022/3/18/now-more-than-ever-voters-support-ramping-up-clean-energy-production-in-the-us,True
"Fri, 11 Ma",The Green New Deal is Incredibly Popular,https://www.dataforprogress.org/blog/2022/3/11/the-green-new-deal-is-incredibly-popular,False
"Fri, 11 Ma",Ritchie Torres is Popular With NY-15 Democratic Primary Voters in His District,https://www.dataforprogress.org/blog/2022/3/9/ritchie-torres-is-popular-with-ny-15-democratic-primary-voters-and-well-positioned-to-win-re-election,True
"Fri, 11 Ma",Voters Continue to Strongly Support the American Rescue Plan,https://www.dataforprogress.org/blog/2022/3/11/american-rescue-plan-one-year-later,True
"Thu, 10 Ma","In Light of Alarming New IPCC Report, Voters Are Ready for Government Action",https://www.dataforprogress.org/blog/2022/3/10/voters-want-action-for-climate-resilience,True
"Fri, 04 Ma",Majority of Voters Back Biden on Ukraine — Once They Learn About It,https://www.dataforprogress.org/blog/2022/3/4/majority-of-voters-back-biden-on-ukraine-once-they-learn-about-it,True
"Thu, 03 Ma",Voters Support the America COMPETES Act,https://www.dataforprogress.org/blog/2022/3/3/voters-support-the-america-competes-act,True
"Tue, 01 Ma",How the Build Back Better Act Would Address the Price Increases Hitting Families Hardest,https://www.dataforprogress.org/blog/2022/3/1/how-the-build-back-better-act-would-address-the-price-increases-hitting-families-hardest,False
"Wed, 23 Fe","Transphobia is a Powerful Force in American Politics, but Young Voters are Leading a Cultural Shift Towards Inclusion",https://www.dataforprogress.org/blog/2022/2/23/transphobia-is-a-powerful-force-in-american-politics-but-young-voters-are-leading-a-cultural-shift-towards-inclusion,True
"Tue, 22 Fe",Canceling Student Debt Is Good Policy and Good Politics,https://www.dataforprogress.org/blog/2022/2/22/jones-canceling-student-loans-is-good-policy-and-good-politics,False
"Fri, 18 Fe",Voters Do Not Support Banning Books from School Curriculums,https://www.dataforprogress.org/blog/2022/2/18/voters-do-not-support-banning-books-from-school-curriculums,True
"Wed, 16 Fe","American Voters of All Backgrounds Face Financial Stress, Demand Restitution From Corporations and Politicians ",https://www.dataforprogress.org/blog/2022/2/16/american-voters-of-all-backgrounds-face-financial-stress-demand-restitution-from-corporations-and-politicians,True
"Wed, 16 Fe",Analyzing Public Trust in Government Agencies,https://www.dataforprogress.org/blog/2022/2/16/analyzing-public-trust-in-government-agencies,False
"Tue, 15 Fe","In Dealing With Ukraine, Voters Want to Avoid War With Russia",https://www.dataforprogress.org/blog/2022/2/15/in-dealing-with-ukraine-voters-want-to-avoid-war-with-russia,True
"Tue, 15 Fe",Voters Support Federal Investments to Reduce Pollution From the Manufacturing Sector,https://www.dataforprogress.org/blog/2022/2/15/voters-support-federal-investments-to-reduce-pollution-from-the-manufacturing-sector,True
"Mon, 14 Fe",Sen. Schumer: It's Time to Make it in America,https://www.dataforprogress.org/blog/2022/2/14/senator-schumer-make-it-in-america,False
"Mon, 14 Fe",Voters Support Biden’s Pledge to Nominate a Black Woman for the Supreme Court,https://www.dataforprogress.org/blog/2022/2/14/voters-support-bidens-pledge-to-nominate-a-black-woman-for-the-supreme-court,True
"Fri, 11 Fe",Voters Don’t Want Retirement Funds Invested in Oil and Gas — Especially Not Their Own,https://www.dataforprogress.org/blog/2022/2/11/voters-dont-want-retirement-funds-invested-in-oil-and-gas-especially-not-their-own,True
