date,title,url,is_polling
"Mon, 28 De","Seventy-Eight Percent of Likely Voters Support $2,000 Coronavirus Relief Checks ",https://www.dataforprogress.org/blog/2020/12/28/78-of-likely-voters-support-2000-relief-checks,True
"Mon, 28 De",More Relief and Unemployment Benefits Hinges on Georgia,https://www.dataforprogress.org/blog/2020/12/28/more-relief-and-unemployment-benefits-hinges-on-georgia,False
"Mon, 28 De",A Brave New World of Climate Politics,https://www.dataforprogress.org/blog/2020/12/28/a-brave-new-world-of-climate-politics,False
"Tue, 22 De",Remove Financial Barriers to Running for Office ,https://www.dataforprogress.org/blog/2020/12/22/remove-financial-barriers-to-running-for-office,False
"Mon, 21 De",The Energy Package Could Be a Popular Step in the Right Direction,https://www.dataforprogress.org/blog/2020/12/21/the-energy-package-could-be-a-popular-step-in-the-right-direction,False
"Mon, 21 De","Next Time Could Be Worse: Why the US Needs Coherent Industrial Policy to Confront the Next Crisis, China, and Income Inequality",https://www.dataforprogress.org/blog/2020/12/21/why-the-us-needs-coherent-industrial-policy,False
"Sun, 20 De",The Next Federal Budget Deal Must Include Aid to State and Local Governments,https://www.dataforprogress.org/blog/2020/12/20/a-federal-budget-deal-should-include-aid-to-state-and-local-governments,False
"Fri, 18 De",DFP Coronavirus Response Tracking Poll Week 36,https://www.dataforprogress.org/blog/week-36-coronavirus-tracking-poll,True
"Thu, 10 De",When Justice and Politics Match: Deb Haaland Should be Biden’s Interior Secretary,https://www.dataforprogress.org/blog/2020/12/10/when-justice-and-politics-match-deb-haaland-should-be-bidens-interior-secretary,False
"Thu, 10 De",It’s Time for Congress to Give Public Transportation the Funding It Deserves,https://www.dataforprogress.org/blog/2020/12/10/give-public-transportation-the-funding-it-deserves,False
"Wed, 09 De",Voters Oppose Drilling in the Arctic National Wildlife Refuge,https://www.dataforprogress.org/blog/2020/12/9/voters-oppose-drilling-in-the-arctic-national-wildlife-refuge,True
"Fri, 04 De",Americans Want to Tax Film Franchises to Fund the Arts,https://www.dataforprogress.org/blog/2020/12/4/americans-want-to-tax-film-franchises-to-fund-the-arts,False
"Tue, 01 De",Congress Must Pass the American Worker Holiday Relief Act,https://www.dataforprogress.org/blog/2020/12/1/congress-must-pass-the-american-worker-holiday-relief-act,False
"Mon, 30 No",Voters Reject the Politics of Austerity,https://www.dataforprogress.org/blog/2020/11/30/voters-reject-the-politics-of-austerity,True
"Wed, 25 No",A Yellen Treasury Department is Good News for the Climate,https://www.dataforprogress.org/blog/2020/11/25/a-yellen-treasury-department-is-good-news-for-the-climate,False
"Fri, 20 No",We Need a Clean Energy Economic Recovery,https://www.dataforprogress.org/blog/2020/11/20/we-need-a-clean-energy-economic-recovery,False
"Thu, 19 No",Green New Deal Slate Victories,https://www.dataforprogress.org/blog/2020/11/19/green-new-deal-slate-victories,False
"Tue, 10 No",Voters Support Redistributive Economic Policies ,https://www.dataforprogress.org/blog/2020/11/10/voters-support-redistributive-economic-policies,True
"Tue, 03 No",DFP Final Election Polling,https://www.dataforprogress.org/blog/2020/11/3/dfp-final-election-polling,True
"Mon, 02 No",The Most Important Chart You’ll See Today,https://www.dataforprogress.org/blog/2020/11/2/the-most-important-chart-youll-see-today,False
"Mon, 02 No",Voters Support Deficit Spending and Trust the Democratic Party More On Questions of the Debt,https://www.dataforprogress.org/blog/2020/11/2/voters-support-deficit-spending,True
"Sun, 01 No",Joe Biden Continues to Lead Trump Heading Into Election Day,https://www.dataforprogress.org/blog/2020/11/1/joe-biden-continues-to-lead-trump-heading-into-election-day,False
"Fri, 30 Oc","For Our Climate, the Senate Should Start Over on Transportation ",https://www.dataforprogress.org/blog/2020/10/30/for-our-climate-the-senate-should-start-over-on-transportationnbsp,False
"Thu, 29 Oc",Visualizing the Representation Gap,https://www.dataforprogress.org/blog/2020/10/28/visualizing-the-representation-gap,False
"Thu, 29 Oc",Voters Support Deficit Spending When Tied to Material Benefits,https://www.dataforprogress.org/blog/2020/10/29/voters-support-deficit-spending,True
"Wed, 28 Oc",Trump’s “Fossil Fuel Voters” Are a Myth,https://www.dataforprogress.org/blog/2020/10/28/trumps-fossil-fuel-voters-are-a-myth,True
"Mon, 26 Oc",A Great Depression Prescription for a Pandemic Era,https://www.dataforprogress.org/blog/2020/10/26/a-great-depression-prescription-for-a-pandemic-era,False
"Fri, 23 Oc","Biden Delivers Another Strong Showing, Emerges Clear Winner of Final Presidential Debate",https://www.dataforprogress.org/blog/2020/10/23/biden-delivers-another-strong-showing,False
"Fri, 23 Oc",I Know Republican Voters Support Climate Action -- I Have Seen It In San Diego,https://www.dataforprogress.org/blog/2020/10/23/its-possible-to-get-republican-voters-to-support-action-on-climate-change,True
"Fri, 23 Oc",DFP Coronavirus Response Tracking Poll Week 28,https://www.dataforprogress.org/blog/week-28-coronavirus-tracking-poll,True
"Thu, 22 Oc",Our Government Isn’t Progressive—But America Is,https://www.dataforprogress.org/blog/2020/10/21/our-government-isnt-progressive-but-america-is,False
"Wed, 21 Oc",Phoenix Voters Support Clean Energy Investments,https://www.dataforprogress.org/blog/2020/10/21/phoenix-voters-support-clean-energy-investments,True
"Mon, 19 Oc",Voters Oppose Conservative Jurisprudence,https://www.dataforprogress.org/blog/2020/10/19/voters-oppose-conservative-jurisprudence,True
"Thu, 15 Oc",Introducing the Election Night Integrity Project,https://www.dataforprogress.org/blog/election-night-integrity-project,False
"Tue, 13 Oc",Voters Support Removing Traffic Enforcement From Police Purview in New York,https://www.dataforprogress.org/blog/2020/10/13/voters-support-removing-traffic-enforcement-from-police-purview-in-new-york,True
"Fri, 09 Oc",The “Radical Socialist” Climate Plan Biden Proposes is Actually Really Popular,https://www.dataforprogress.org/blog/2020/10/9/the-radical-socialist-climate-plan-biden-proposes-is-popular,False
"Thu, 08 Oc",Voters Want the Senate to Prioritize Coronavirus Relief Over a Supreme Court Nomination,https://www.dataforprogress.org/blog/2020/10/7/voters-want-the-senate-to-prioritize-coronavirus-relief,True
"Thu, 08 Oc",DFP Coronavirus Response Tracking Poll Week 26,https://www.dataforprogress.org/blog/week-26-coronavirus-tracking-poll,True
"Fri, 02 Oc",Joe Biden Maintains a Commanding Lead in the Presidential Race,https://www.dataforprogress.org/blog/2020/10/2/joe-biden-maintains-a-commanding-lead-in-the-presidential-race,False
"Thu, 01 Oc","If We Want Racial Justice, We Have to Take on Amazon",https://www.dataforprogress.org/blog/2020/10/1/if-we-want-racial-justice-we-have-to-take-on-amazon,False
"Thu, 01 Oc",Green New Deal Slate,https://www.dataforprogress.org/blog/green-new-deal-slate,False
"Thu, 01 Oc",The Rent is Too High and Here’s What We Can Do About it ,https://www.dataforprogress.org/blog/2020/10/1/the-rent-is-too-high-and-heres-what-we-can-do-about-it,False
"Wed, 30 Se",Biden Emerges From the First Presidential Debate a Clear Winner,https://www.dataforprogress.org/blog/2020/9/30/biden-emerges-from-the-first-presidential-debate-a-clear-winner,False
"Mon, 28 Se",We Must Utilize Educational Programming for Fossil Fuel Workers in the Just Transition,https://www.dataforprogress.org/blog/2020/9/28/utilize-educational-programming-for-fossil-fuel-workers,False
"Thu, 24 Se","Americans Think the Senate Should be Prioritizing Coronavirus Relief, Not a Supreme Court Confirmation",https://www.dataforprogress.org/blog/2020/9/24/prioritize-coronavirus-relief-not-supreme-court-confirmation,False
"Tue, 22 Se",A Trump Replacement of RBG is Likely to Devastate Progressive Priorities,https://www.dataforprogress.org/blog/2020/9/22/a-trump-replacement-of-rbg-is-likely-to-devastate-progressive-priorities,False
"Mon, 21 Se",A Majority Of Voters Oppose President Trump Filling The Vacancy On the Supreme Court,https://www.dataforprogress.org/blog/2020/9/21/a-majority-of-voters-oppose-president-trump-filling-the-vacancy-on-the-supreme-court,True
"Mon, 21 Se",How to Protect the Affordable Care Act From its Latest Legal Challenge,https://www.dataforprogress.org/blog/2020/9/21/how-to-protect-the-affordable-care-act,False
"Sat, 19 Se","If Trump Replaces RBG, Congress Must Expand The Court",https://www.dataforprogress.org/blog/2020/9/19/if-trump-replaces-rbg-expand-the-court,False
"Fri, 18 Se",Voters Overwhelmingly Oppose Trump’s Plan to Defund Social Security,https://www.dataforprogress.org/blog/2020/9/18/voters-oppose-trumps-plan-to-defund-social-security,True
"Fri, 18 Se",DFP Coronavirus Response Tracking Poll Week 23,https://www.dataforprogress.org/blog/week-23-coronavirus-tracking-poll,True
"Thu, 17 Se",Voters Want to See More Climate Coverage in the Media,https://www.dataforprogress.org/blog/2020/9/17/voters-want-to-see-more-climate-coverage-in-the-media,True
"Thu, 17 Se",Exposure to Wildfires Increases Support for Climate Action,https://www.dataforprogress.org/blog/2020/9/17/wildfire-exposure-increases-climate-action-support,True
"Thu, 17 Se",The President Doesn’t Need Congress to Cancel Student Loan Debt. Democrats Will Push For Action in 2021,https://www.dataforprogress.org/blog/2020/9/17/the-president-doesnt-need-congress-to-cancel-student-loan-debt-democrats-will-push-for-action-in-2021,False
"Wed, 16 Se",Voters—Including Republicans—Think Climate Change is Making Weather More Extreme,https://www.dataforprogress.org/blog/2020/9/16/voters-think-climate-change-is-making-weather-more-extreme,True
"Fri, 11 Se",Don’t Let John Roberts Fool You,https://www.dataforprogress.org/blog/2020/9/11/dont-let-john-roberts-fool-you,False
"Tue, 08 Se",Voters Support Environmental Justice for All,https://www.dataforprogress.org/blog/2020/9/8/voters-support-environmental-justice-for-all,True
"Tue, 08 Se",Voters Have Moved in Favor of DC and Puerto Rico Statehood,https://www.dataforprogress.org/blog/2020/9/8/voters-favor-dc-and-puerto-rico-statehood,True
"Fri, 04 Se",Voters Want to Protect U.S. Postal Service Standards,https://www.dataforprogress.org/blog/2020/9/4/voters-want-to-protect-usps-standards,True
"Fri, 04 Se",DFP Coronavirus Response Tracking Poll Week 21,https://www.dataforprogress.org/blog/week-21-coronavirus-tracking-poll,True
"Wed, 02 Se",Voters Want to Cancel Fossil Fuels ,https://www.dataforprogress.org/blog/2020/9/2/voters-want-to-cancel-fossil-fuels,True
"Fri, 28 Au",Some NBA Owners’ Rhetoric is Contradicted by Donations,https://www.dataforprogress.org/blog/2020/8/28/some-nba-owners-rhetoric-is-contradicted-by-donations,False
"Fri, 28 Au",Black Athletes are Striking and Voters Support Them,https://www.dataforprogress.org/blog/2020/8/28/black-athletes-are-striking-voters-support-them,True
"Thu, 27 Au",Voters Prioritize Protecting Social Security,https://www.dataforprogress.org/blog/2020/8/27/voters-prioritize-protecting-social-security,True
"Thu, 27 Au",Voters Trust Biden on Climate Change,https://www.dataforprogress.org/blog/2020/8/27/voters-trust-biden-on-climate-change,True
"Thu, 20 Au",Data for Progress Report on the State of the Race,https://www.dataforprogress.org/blog/2020/8/20/report-on-the-state-of-the-race,False
"Thu, 20 Au","What, If Anything, Would Make People Abandon Their Presidential Candidate in the Next Three Months?",https://www.dataforprogress.org/blog/2020/8/20/what-would-make-people-abandon-their-presidential-candidate,False
"Wed, 19 Au","President Obama Is Right: To Save Our Democracy, End the Senate Filibuster",https://www.dataforprogress.org/blog/2020/8/19/end-the-senate-filibuster,False
"Tue, 18 Au",Voters Want The USPS Funded As An Essential Service,https://www.dataforprogress.org/blog/2020/8/18/voters-support-the-united-states-postal-service,True
"Fri, 14 Au",Biden’s Public Option is a BFD—and a Super-Popular One,https://www.dataforprogress.org/blog/2020/8/14/bidens-public-option-is-a-bfd,False
"Fri, 14 Au",DFP Coronavirus Response Tracking Poll Week 18,https://www.dataforprogress.org/blog/week-18-coronavirus-tracking-poll,True
"Fri, 14 Au",Voters Oppose the Trump Administration’s NEPA Rollbacks,https://www.dataforprogress.org/blog/2020/8/14/voters-oppose-the-trump-administrations-nepa-rollbacks,True
"Thu, 13 Au",Voters Support Eliminating The Filibuster,https://www.dataforprogress.org/blog/2020/8/13/voters-support-eliminating-the-filibuster,True
"Wed, 12 Au",Democrats: Fight the Drug Companies to Win Back the Senate,https://www.dataforprogress.org/blog/2020/8/12/democrats-fight-drug-companies-to-win-back-senate,False
"Wed, 12 Au",This Chart Shows How Much Turnout Could Matter in November,https://www.dataforprogress.org/blog/2020/8/12/how-much-turnout-could-matter-in-november,False
"Tue, 11 Au",The End of the CARES Act and What is to be Done ,https://www.dataforprogress.org/blog/2020/8/7/the-end-of-the-cares-act,False
"Tue, 11 Au",Masks for All Isn’t a Radical Idea,https://www.dataforprogress.org/blog/2020/8/11/masks-for-all-isnt-a-radical-idea,False
"Wed, 05 Au",Who is Going to Speak Out for Our Kids and Communities?,https://www.dataforprogress.org/blog/2020/8/5/who-is-going-to-speak-out-for-our-kids-and-communities,False
"Tue, 04 Au",Great American Outdoors Act,https://www.dataforprogress.org/blog/2020/8/4/great-american-outdoors-act,False
"Fri, 31 Ju",Why We Must Expand the Child Tax Credit ,https://www.dataforprogress.org/blog/2020/7/31/why-we-must-expand-the-child-tax-credit,False
"Fri, 31 Ju",DFP Coronavirus Response Tracking Poll Week 16,https://www.dataforprogress.org/blog/week-16-coronavirus-tracking-poll,True
"Thu, 30 Ju",Biden Must Prioritize the Courts if Elected,https://www.dataforprogress.org/blog/biden-must-prioritize-the-courts-if-elected,False
"Wed, 29 Ju",Making the Case for the Clean Energy Innovation and Deployment Act,https://www.dataforprogress.org/blog/2020/7/29/clean-energy-innovation-and-deployment-act,False
"Tue, 28 Ju",Rep. Michael McCaul’s Failure of Imagination,https://www.dataforprogress.org/blog/2020/7/28/michael-mccauls-failure-of-imagination,False
"Mon, 27 Ju",Information Districts Are a Popular Way to Expand Funding for Public Media,https://www.dataforprogress.org/blog/2020/7/27/information-districts-expand-public-media-funding,False
"Fri, 24 Ju",Voters Support Extending The Expanded Unemployment Benefits,https://www.dataforprogress.org/blog/2020/7/24/voters-support-extending-the-expanded-unemployment-benefits,True
"Fri, 24 Ju",Stopping President Trump’s Federally-Funded Phony Health Clinics,https://www.dataforprogress.org/blog/2020/7/24/stopping-trumps-phony-health-clinics,False
"Fri, 24 Ju",DFP Coronavirus Response Tracking Poll Week 15,https://www.dataforprogress.org/blog/week-15-coronavirus-tracking-poll,True
"Wed, 22 Ju",Out-Of-Work Americans Worry About Their Health and Finances as Expanded Unemployment Insurance Benefits Are Set to Expire,https://www.dataforprogress.org/blog/2020/7/22/out-of-work-americans-worry-about-their-health-and-finances-as-expanded-unemployment-insurance-benefits-are-set-to-expire,False
"Tue, 21 Ju",Americans Want to Reinvest Ten Percent of the Military Budget Against Coronavirus,https://www.dataforprogress.org/blog/2020/7/21/americans-want-to-reinvest-military-budget,True
"Mon, 20 Ju",The American People Agree: Cut the Pentagon’s Budget ,https://www.dataforprogress.org/blog/2020/7/20/cut-the-pentagons-budget,False
"Fri, 17 Ju",The Partisan Battle Lines on Housing are Clear,https://www.dataforprogress.org/blog/2020/7/16/partisan-battle-lines-on-housing-are-clear,False
"Thu, 16 Ju",Voters Support The Economic Justice Act,https://www.dataforprogress.org/blog/2020/7/16/low-income-and-communities-of-color-prioritized-in-coronavirus-relief,True
"Wed, 15 Ju",Black Women Best,https://www.dataforprogress.org/blog/2020/7/15/black-women-best,False
"Tue, 14 Ju","Joe Biden Moves Left on Climate, Voters Love To See It",https://www.dataforprogress.org/blog/2020/7/14/biden-moves-left-on-climate,True
"Tue, 14 Ju",Voters Support Postal Banking,https://www.dataforprogress.org/blog/2020/7/14/voters-support-postal-banking,True
"Fri, 10 Ju",Announcing The Launch Of The CARES Act Bot,https://www.dataforprogress.org/blog/2020/7/10/announcing-the-launch-of-the-cares-act-bot,False
"Fri, 10 Ju",DFP Coronavirus Response Tracking Poll Week 13,https://www.dataforprogress.org/blog/week-13-coronavirus-tracking-poll,True
"Thu, 09 Ju","To Create Structural Change and Real Representation, Start with Campaign Finance Reform",https://www.dataforprogress.org/blog/2020/7/9/candace-valenzuela-campaign-finance-reform,False
"Wed, 08 Ju",A Paycheck Guarantee is Popular with Voters ,https://www.dataforprogress.org/blog/2020/7/8/paycheck-guarantee-is-popular,True
"Mon, 06 Ju",A Majority Of Voters Think That Attorney General Bill Barr Should Be Impeached,https://www.dataforprogress.org/blog/2020/7/6-attorney-general-bill-barr-should-be-impeached,True
"Fri, 03 Ju",Support for Cutting Law Enforcement Funding has Spiked in the Wake of the Recent Protests,https://www.dataforprogress.org/blog/2020/7/3/support-for-cutting-law-enforcement-funding-has-spiked,True
"Thu, 02 Ju","Continue the $600 Unemployment Boost, Don’t Phase It Out",https://www.dataforprogress.org/blog/2020/7/2/continue-the-unemployment-boost,False
"Thu, 02 Ju",Voters Support Extending The Expanded Unemployment Benefits Until The End Of This Crisis,https://www.dataforprogress.org/blog/2020/6/26/voters-support-extending-the-expanded-unemployment-benefits-until-the-end-of-this-crisis,True
"Wed, 01 Ju",Voters Don’t Want Police Departments to Have Military Equipment,https://www.dataforprogress.org/blog/2020/7/1/voters-dont-want-police-departments-to-have-military-equipment,True
"Wed, 01 Ju",Taking Politics Out of Unemployment Insurance,https://www.dataforprogress.org/blog/2020/7/1/taking-politics-out-of-unemployment-insurance-a-new-proposal-to-rescue-working-families-suffering-from-the-coronavirus-economic-downturn,False
"Tue, 30 Ju","The Select Committee on the Climate Crisis Mixtape is Good, Actually",https://www.dataforprogress.org/blog/2020/6/30/the-select-committee-on-the-climate-crisis-mixtape-is-good-actually,False
"Fri, 26 Ju",DFP Coronavirus Response Tracking Poll Week 11,https://www.dataforprogress.org/blog/2020/6/26/week-11-coronavirus-tracking-poll,True
"Tue, 23 Ju",Empowering Communities on the Frontlines of Coronavirus and Climate Change,https://www.dataforprogress.org/blog/6/23/empowering-communities-coronavirus-climate-change,False
"Mon, 22 Ju",Elizabeth Warren Leads the Vice Presidential Choice,https://www.dataforprogress.org/blog/2020/6/22/elizabeth-warren-leads-the-vice-presidential-choice,False
"Sun, 21 Ju",The Emergent Partisan Gap in Social Distancing,https://www.dataforprogress.org/blog/2020/6/21/the-emergent-partisan-gap-in-social-distancing,False
"Thu, 18 Ju",Electoral College Victory for Joe Biden Could Hinge on Swaying White Working-Class Voters in Key States,https://www.dataforprogress.org/blog/6/18/electoral-college-win-for-biden,True
"Tue, 16 Ju",Just Cause is a Civil Rights Issue,https://www.dataforprogress.org/blog/6/16/just-cause-is-a-civil-rights-issue,False
"Tue, 16 Ju",Voters Support the Use of a Nonpolice First-Responder Agency ,https://www.dataforprogress.org/blog/2020/6/16/voters-support-the-use-of-nonpolice-first-responders,True
"Mon, 15 Ju","White Republicans and Independents are Starting to Acknowledge Their Privilege, But Will It Last?",https://www.dataforprogress.org/blog/2020/6/15/white-republicans-and-independents-are-starting-to-acknowledge-their-privilege-but-will-it-last,False
"Sun, 14 Ju",Progressives Control the Future,https://www.dataforprogress.org/blog/6/14/progressives-control-the-future,False
"Fri, 12 Ju",Voters Support Holding Police Accountable,https://www.dataforprogress.org/blog/6/12/police-accountability-at-protests,True
"Fri, 12 Ju",DFP Coronavirus Response Tracking Poll Week 8 ,https://www.dataforprogress.org/blog/week-8-coronavirus-tracking-poll,True
"Fri, 12 Ju",Voters Want a Non-Police First Responder Agency for Addiction and Mental Health,https://www.dataforprogress.org/blog/6/11/voters-want-non-police-first-responders,True
"Wed, 10 Ju",How Americans Feel About Socialism in the Midst of the Coronavirus Crisis,https://www.dataforprogress.org/blog/2020/6/10/how-americans-feel-about-socialism,False
"Tue, 09 Ju","Younger Voters Do Not Trust the Police, Support an end to Qualified Immunity  ",https://www.dataforprogress.org/blog/2020/6/9/younger-voters-do-not-trust-the-police-support-an-end-to-qualified-immunity,True
"Tue, 09 Ju",Democrats Aren’t Running Pro-Biden Ads. The Data Says They Should Be.,https://www.dataforprogress.org/blog/2020/6/9/dems-should-run-pro-biden-ads,False
"Sun, 07 Ju","Voters Support Protests, Have Lost Trust In Police",https://www.dataforprogress.org/blog/2020/6/6/voters-support-reforms-have-lost-trust-in-police,True
"Tue, 02 Ju",Most Voters Think a Police Officer Murdered George Floyd,https://www.dataforprogress.org/blog/6/2/george-floyd-murder,True
"Sat, 30 Ma",DFP Coronavirus Response Tracking Poll Week 7,https://www.dataforprogress.org/blog/5/30/week-7-coronavirus-tracking-poll,True
"Wed, 27 Ma",Voters Have Mixed Opinions About America’s Party System ,https://www.dataforprogress.org/blog/5/27/mixed-opinions-about-americas-party-system,True
"Tue, 26 Ma",Americans Want to Raise the Poverty Line,https://www.dataforprogress.org/blog/2020/5/26/americans-want-to-raise-the-poverty-line,False
"Fri, 22 Ma",DFP Coronavirus Response Tracking Poll Week 6,https://www.dataforprogress.org/blog/week-6-coronavirus-tracking-poll,True
"Thu, 21 Ma",New Polling Reveals Strong Support for Medicare for Kids ,https://www.dataforprogress.org/blog/5/21/medicare-for-kids,True
"Tue, 19 Ma",The Bronx Is an Epicenter for Coronavirus and Environmental Injustice,https://www.dataforprogress.org/blog/5/18/bronx-is-epicenter-for-coronavirus,False
"Fri, 15 Ma",DFP Coronavirus Response Tracking Poll Week 5,https://www.dataforprogress.org/blog/week-5-coronavirus-tracking-poll,True
"Fri, 08 Ma","Coronavirus Relief Funds Should go to People, Not Polluters",https://www.dataforprogress.org/blog/5/8/covid-relief-for-people-not-polluters,True
"Fri, 08 Ma",Electric FREAKING Postal Vans ,https://www.dataforprogress.org/blog/5/8/electric-freaking-postal-vans,False
"Thu, 07 Ma",DFP Coronavirus Response Tracking Poll Week 4,https://www.dataforprogress.org/blog/5/7/coronavirus-response-tracking-week-4,True
"Wed, 06 Ma","In Georgia, Coronavirus and Environmental Racism Combine",https://www.dataforprogress.org/blog/5/6/coronavirus-and-racism-combine-in-georgia,False
"Wed, 06 Ma",States Need Direct Cash Assistance From Washington to Prevent a Spike in Unemployment and to Keep First Responders and Educators on the Job,https://www.dataforprogress.org/blog/2020/5/6/states-need-direct-cash-assistance-from-washington-to-prevent-a-spike-in-unemployment,False
"Tue, 05 Ma",The Coronavirus Pandemic Has Made Voters More Supportive of the Green New Deal,https://www.dataforprogress.org/blog/5/5/coronavirus-makes-voters-support-gnd,True
"Mon, 04 Ma",Public Opinion about Federalism during the Coronavirus Pandemic,https://www.dataforprogress.org/blog/5/4/public-opinion-federalism,False
"Sat, 02 Ma",Has Joe Biden Improved Democratic Performance Among 65+ Old Voters So Far?,https://www.dataforprogress.org/blog/5/02/biden-performance-with-older-voters,True
"Sat, 02 Ma",How to Actually Build Things - A Response to Marc Andreeson,https://www.dataforprogress.org/blog/5/1/how-to-actually-build-things,False
"Fri, 01 Ma",Expanding Coronavirus Aid to Mixed Immigration Status Families is Popular,https://www.dataforprogress.org/blog/5/1/coronavirus-aid-to-mixed-immigration-status-families,False
"Fri, 01 Ma",Voters Support A Public Option For Broadband ,https://www.dataforprogress.org/blog/5/1/support-for-universal-broadband,True
"Fri, 01 Ma",DFP Coronavirus Tracking Poll Week 3,https://www.dataforprogress.org/blog/5/1/week-3-coronavirus-tracking-poll,True
"Fri, 01 Ma",Voters Support a General Strike,https://www.dataforprogress.org/blog/5/1/voters-support-general-strike,True
"Thu, 30 Ap",Voters Support Replacing 100 Percent Of Workers’ Wages During This Crisis ,https://www.dataforprogress.org/blog/2020/4/30/voters-support-replacing-100-percent-of-workers-wages-during-this-crisis,True
"Thu, 30 Ap",Voters Support Government Manufacturing of Drugs And Other Medical Supplies,https://www.dataforprogress.org/blog/4/30/voters-support-public-drug-manufacturing,True
"Wed, 29 Ap","Voters Support Aid To Cities And States, Oppose Ending Social Distancing",https://www.dataforprogress.org/blog/2020/4/29/voters-support-aid-to-cities-and-states-oppose-ending-social-distancing,True
"Wed, 29 Ap",The World Needs a Post-Coronavirus Green Marshall Plan,https://www.dataforprogress.org/blog/4/29/world-needs-green-marshall-plan,False
"Tue, 28 Ap",The Voters of OH-03 Support The Progressive Agenda,https://www.dataforprogress.org/blog/2020/4/28/morgan-harper-polling,True
"Mon, 27 Ap","Coronavirus Response Tracking Poll, Week 1 and 2",https://www.dataforprogress.org/blog/2020/4/27/coronavirus-response-tracking-poll-1,True
"Fri, 24 Ap",Voters Support Empowering Medicare To Cover Americans Health Care Costs During The Crisis,https://www.dataforprogress.org/blog/2020/4/24/voters-support-empowering-medicare-to-cover-americans-health-care-costs-during-the-crisis,True
